21:37:43.249714 IP channel-ecmp-05-ash3.facebook.com.https > 67-194-197-7.wireless.umnet.umich.edu.58515: Flags [P.], seq 2707955542:2707955927, ack 2458636666, win 181, options [nop,nop,TS val 3857097285 ecr 623482723], length 385
21:37:43.249879 IP 67-194-197-7.wireless.umnet.umich.edu.58515 > channel-ecmp-05-ash3.facebook.com.https: Flags [.], ack 385, win 8167, options [nop,nop,TS val 623522452 ecr 3857097285], length 0
21:37:43.263932 IP 67-194-197-7.wireless.umnet.umich.edu.58515 > channel-ecmp-05-ash3.facebook.com.https: Flags [P.], seq 1:976, ack 385, win 8192, options [nop,nop,TS val 623522466 ecr 3857097285], length 975
21:37:43.292372 IP channel-ecmp-05-ash3.facebook.com.https > 67-194-197-7.wireless.umnet.umich.edu.58515: Flags [.], ack 976, win 181, options [nop,nop,TS val 3857097400 ecr 623522466], length 0
21:38:23.671414 IP channel-ecmp-05-ash3.facebook.com.https > 67-194-197-7.wireless.umnet.umich.edu.58515: Flags [P.], seq 385:770, ack 976, win 181, options [nop,nop,TS val 3857137776 ecr 623522466], length 385
21:38:23.671600 IP 67-194-197-7.wireless.umnet.umich.edu.58515 > channel-ecmp-05-ash3.facebook.com.https: Flags [.], ack 770, win 8167, options [nop,nop,TS val 623562804 ecr 3857137776], length 0
21:38:23.686456 IP 67-194-197-7.wireless.umnet.umich.edu.58515 > channel-ecmp-05-ash3.facebook.com.https: Flags [P.], seq 976:1962, ack 770, win 8192, options [nop,nop,TS val 623562818 ecr 3857137776], length 986
21:38:23.714256 IP channel-ecmp-05-ash3.facebook.com.https > 67-194-197-7.wireless.umnet.umich.edu.58515: Flags [.], ack 1962, win 181, options [nop,nop,TS val 3857137822 ecr 623562818], length 0
21:39:04.097711 IP channel-ecmp-05-ash3.facebook.com.https > 67-194-197-7.wireless.umnet.umich.edu.58515: Flags [P.], seq 770:1155, ack 1962, win 181, options [nop,nop,TS val 3857178092 ecr 623562818], length 385
21:39:04.097966 IP 67-194-197-7.wireless.umnet.umich.edu.58515 > channel-ecmp-05-ash3.facebook.com.https: Flags [.], ack 1155, win 8167, options [nop,nop,TS val 623603149 ecr 3857178092], length 0
21:39:04.112786 IP 67-194-197-7.wireless.umnet.umich.edu.58515 > channel-ecmp-05-ash3.facebook.com.https: Flags [P.], seq 1962:2949, ack 1155, win 8192, options [nop,nop,TS val 623603163 ecr 3857178092], length 987
21:39:04.143880 IP channel-ecmp-05-ash3.facebook.com.https > 67-194-197-7.wireless.umnet.umich.edu.58515: Flags [.], ack 2949, win 181, options [nop,nop,TS val 3857178250 ecr 623603163], length 0
21:39:44.674745 IP channel-ecmp-05-ash3.facebook.com.https > 67-194-197-7.wireless.umnet.umich.edu.58515: Flags [P.], seq 1155:1540, ack 2949, win 181, options [nop,nop,TS val 3857218782 ecr 623603163], length 385
21:39:44.674966 IP 67-194-197-7.wireless.umnet.umich.edu.58515 > channel-ecmp-05-ash3.facebook.com.https: Flags [.], ack 1540, win 8167, options [nop,nop,TS val 623643598 ecr 3857218782], length 0
21:39:44.687722 IP 67-194-197-7.wireless.umnet.umich.edu.58515 > channel-ecmp-05-ash3.facebook.com.https: Flags [P.], seq 2949:3922, ack 1540, win 8192, options [nop,nop,TS val 623643610 ecr 3857218782], length 973
21:39:44.716535 IP channel-ecmp-05-ash3.facebook.com.https > 67-194-197-7.wireless.umnet.umich.edu.58515: Flags [.], ack 3922, win 181, options [nop,nop,TS val 3857218824 ecr 623643610], length 0
21:40:25.563793 IP channel-ecmp-05-ash3.facebook.com.https > 67-194-197-7.wireless.umnet.umich.edu.58515: Flags [P.], seq 1540:1925, ack 3922, win 181, options [nop,nop,TS val 3857259605 ecr 623643610], length 385
21:40:25.563997 IP 67-194-197-7.wireless.umnet.umich.edu.58515 > channel-ecmp-05-ash3.facebook.com.https: Flags [.], ack 1925, win 8167, options [nop,nop,TS val 623684424 ecr 3857259605], length 0
21:40:25.576821 IP 67-194-197-7.wireless.umnet.umich.edu.58515 > channel-ecmp-05-ash3.facebook.com.https: Flags [P.], seq 3922:4897, ack 1925, win 8192, options [nop,nop,TS val 623684436 ecr 3857259605], length 975
21:40:25.605768 IP channel-ecmp-05-ash3.facebook.com.https > 67-194-197-7.wireless.umnet.umich.edu.58515: Flags [.], ack 4897, win 181, options [nop,nop,TS val 3857259713 ecr 623684436], length 0
21:41:05.329321 IP channel-ecmp-05-ash3.facebook.com.https > 67-194-197-7.wireless.umnet.umich.edu.58515: Flags [P.], seq 1925:2310, ack 4897, win 181, options [nop,nop,TS val 3857299436 ecr 623684436], length 385
21:41:05.329580 IP 67-194-197-7.wireless.umnet.umich.edu.58515 > channel-ecmp-05-ash3.facebook.com.https: Flags [.], ack 2310, win 8167, options [nop,nop,TS val 623723962 ecr 3857299436], length 0
21:41:05.342352 IP 67-194-197-7.wireless.umnet.umich.edu.58515 > channel-ecmp-05-ash3.facebook.com.https: Flags [P.], seq 4897:5872, ack 2310, win 8192, options [nop,nop,TS val 623723974 ecr 3857299436], length 975
21:41:05.370126 IP channel-ecmp-05-ash3.facebook.com.https > 67-194-197-7.wireless.umnet.umich.edu.58515: Flags [.], ack 5872, win 181, options [nop,nop,TS val 3857299478 ecr 623723974], length 0
21:41:45.049608 IP channel-ecmp-05-ash3.facebook.com.https > 67-194-197-7.wireless.umnet.umich.edu.58515: Flags [P.], seq 2310:2695, ack 5872, win 181, options [nop,nop,TS val 3857339155 ecr 623723974], length 385
21:41:45.049833 IP 67-194-197-7.wireless.umnet.umich.edu.58515 > channel-ecmp-05-ash3.facebook.com.https: Flags [.], ack 2695, win 8167, options [nop,nop,TS val 623763615 ecr 3857339155], length 0
21:41:45.063085 IP 67-194-197-7.wireless.umnet.umich.edu.58515 > channel-ecmp-05-ash3.facebook.com.https: Flags [P.], seq 5872:6847, ack 2695, win 8192, options [nop,nop,TS val 623763628 ecr 3857339155], length 975
21:41:45.091140 IP channel-ecmp-05-ash3.facebook.com.https > 67-194-197-7.wireless.umnet.umich.edu.58515: Flags [.], ack 6847, win 181, options [nop,nop,TS val 3857339198 ecr 623763628], length 0
21:42:25.158132 IP channel-ecmp-05-ash3.facebook.com.https > 67-194-197-7.wireless.umnet.umich.edu.58515: Flags [P.], seq 2695:3080, ack 6847, win 181, options [nop,nop,TS val 3857379234 ecr 623763628], length 385
21:42:25.158307 IP 67-194-197-7.wireless.umnet.umich.edu.58515 > channel-ecmp-05-ash3.facebook.com.https: Flags [.], ack 3080, win 8167, options [nop,nop,TS val 623803666 ecr 3857379234], length 0
21:42:25.171880 IP 67-194-197-7.wireless.umnet.umich.edu.58515 > channel-ecmp-05-ash3.facebook.com.https: Flags [P.], seq 6847:7822, ack 3080, win 8192, options [nop,nop,TS val 623803679 ecr 3857379234], length 975
21:42:25.200270 IP channel-ecmp-05-ash3.facebook.com.https > 67-194-197-7.wireless.umnet.umich.edu.58515: Flags [.], ack 7822, win 181, options [nop,nop,TS val 3857379308 ecr 623803679], length 0
21:43:04.848688 IP channel-ecmp-05-ash3.facebook.com.https > 67-194-197-7.wireless.umnet.umich.edu.58515: Flags [P.], seq 3080:3465, ack 7822, win 181, options [nop,nop,TS val 3857418922 ecr 623803679], length 385
21:43:04.848905 IP 67-194-197-7.wireless.umnet.umich.edu.58515 > channel-ecmp-05-ash3.facebook.com.https: Flags [.], ack 3465, win 8167, options [nop,nop,TS val 623843282 ecr 3857418922], length 0
21:43:04.862041 IP 67-194-197-7.wireless.umnet.umich.edu.58515 > channel-ecmp-05-ash3.facebook.com.https: Flags [P.], seq 7822:8797, ack 3465, win 8192, options [nop,nop,TS val 623843295 ecr 3857418922], length 975
21:43:04.890973 IP channel-ecmp-05-ash3.facebook.com.https > 67-194-197-7.wireless.umnet.umich.edu.58515: Flags [.], ack 8797, win 181, options [nop,nop,TS val 3857418998 ecr 623843295], length 0
21:43:45.166002 IP channel-ecmp-05-ash3.facebook.com.https > 67-194-197-7.wireless.umnet.umich.edu.58515: Flags [P.], seq 3465:3850, ack 8797, win 181, options [nop,nop,TS val 3857459207 ecr 623843295], length 385
21:43:45.166160 IP 67-194-197-7.wireless.umnet.umich.edu.58515 > channel-ecmp-05-ash3.facebook.com.https: Flags [.], ack 3850, win 8167, options [nop,nop,TS val 623883504 ecr 3857459207], length 0
21:43:45.179687 IP 67-194-197-7.wireless.umnet.umich.edu.58515 > channel-ecmp-05-ash3.facebook.com.https: Flags [P.], seq 8797:9772, ack 3850, win 8192, options [nop,nop,TS val 623883517 ecr 3857459207], length 975
21:43:45.208503 IP channel-ecmp-05-ash3.facebook.com.https > 67-194-197-7.wireless.umnet.umich.edu.58515: Flags [.], ack 9772, win 181, options [nop,nop,TS val 3857459316 ecr 623883517], length 0
21:44:24.749361 IP channel-ecmp-05-ash3.facebook.com.https > 67-194-197-7.wireless.umnet.umich.edu.58515: Flags [P.], seq 3850:4235, ack 9772, win 181, options [nop,nop,TS val 3857498856 ecr 623883517], length 385
21:44:24.749618 IP 67-194-197-7.wireless.umnet.umich.edu.58515 > channel-ecmp-05-ash3.facebook.com.https: Flags [.], ack 4235, win 8167, options [nop,nop,TS val 623923050 ecr 3857498856], length 0
21:44:24.762379 IP 67-194-197-7.wireless.umnet.umich.edu.58515 > channel-ecmp-05-ash3.facebook.com.https: Flags [P.], seq 9772:10747, ack 4235, win 8192, options [nop,nop,TS val 623923062 ecr 3857498856], length 975
21:44:24.791971 IP channel-ecmp-05-ash3.facebook.com.https > 67-194-197-7.wireless.umnet.umich.edu.58515: Flags [.], ack 10747, win 181, options [nop,nop,TS val 3857498899 ecr 623923062], length 0
21:45:05.487529 IP channel-ecmp-05-ash3.facebook.com.https > 67-194-197-7.wireless.umnet.umich.edu.58515: Flags [P.], seq 4235:4620, ack 10747, win 181, options [nop,nop,TS val 3857539549 ecr 623923062], length 385
21:45:05.487752 IP 67-194-197-7.wireless.umnet.umich.edu.58515 > channel-ecmp-05-ash3.facebook.com.https: Flags [.], ack 4620, win 8167, options [nop,nop,TS val 623963719 ecr 3857539549], length 0
21:45:05.503255 IP 67-194-197-7.wireless.umnet.umich.edu.58515 > channel-ecmp-05-ash3.facebook.com.https: Flags [P.], seq 10747:11722, ack 4620, win 8192, options [nop,nop,TS val 623963734 ecr 3857539549], length 975
21:45:05.531248 IP channel-ecmp-05-ash3.facebook.com.https > 67-194-197-7.wireless.umnet.umich.edu.58515: Flags [.], ack 11722, win 181, options [nop,nop,TS val 3857539638 ecr 623963734], length 0
21:45:45.178189 IP channel-ecmp-05-ash3.facebook.com.https > 67-194-197-7.wireless.umnet.umich.edu.58515: Flags [P.], seq 4620:5005, ack 11722, win 181, options [nop,nop,TS val 3857579227 ecr 623963734], length 385
21:45:45.178376 IP 67-194-197-7.wireless.umnet.umich.edu.58515 > channel-ecmp-05-ash3.facebook.com.https: Flags [.], ack 5005, win 8167, options [nop,nop,TS val 624003327 ecr 3857579227], length 0
21:45:45.191752 IP 67-194-197-7.wireless.umnet.umich.edu.58515 > channel-ecmp-05-ash3.facebook.com.https: Flags [P.], seq 11722:12697, ack 5005, win 8192, options [nop,nop,TS val 624003340 ecr 3857579227], length 975
21:45:45.220194 IP channel-ecmp-05-ash3.facebook.com.https > 67-194-197-7.wireless.umnet.umich.edu.58515: Flags [.], ack 12697, win 181, options [nop,nop,TS val 3857579327 ecr 624003340], length 0
21:46:25.182072 IP channel-ecmp-05-ash3.facebook.com.https > 67-194-197-7.wireless.umnet.umich.edu.58515: Flags [P.], seq 5005:5390, ack 12697, win 181, options [nop,nop,TS val 3857619248 ecr 624003340], length 385
21:46:25.182218 IP 67-194-197-7.wireless.umnet.umich.edu.58515 > channel-ecmp-05-ash3.facebook.com.https: Flags [.], ack 5390, win 8167, options [nop,nop,TS val 624043290 ecr 3857619248], length 0
21:46:25.195625 IP 67-194-197-7.wireless.umnet.umich.edu.58515 > channel-ecmp-05-ash3.facebook.com.https: Flags [P.], seq 12697:13672, ack 5390, win 8192, options [nop,nop,TS val 624043303 ecr 3857619248], length 975
21:46:25.224523 IP channel-ecmp-05-ash3.facebook.com.https > 67-194-197-7.wireless.umnet.umich.edu.58515: Flags [.], ack 13672, win 181, options [nop,nop,TS val 3857619331 ecr 624043303], length 0
21:47:05.628141 IP channel-ecmp-05-ash3.facebook.com.https > 67-194-197-7.wireless.umnet.umich.edu.58515: Flags [P.], seq 5390:5775, ack 13672, win 181, options [nop,nop,TS val 3857659735 ecr 624043303], length 385
21:47:05.628376 IP 67-194-197-7.wireless.umnet.umich.edu.58515 > channel-ecmp-05-ash3.facebook.com.https: Flags [.], ack 5775, win 8167, options [nop,nop,TS val 624083538 ecr 3857659735], length 0
21:47:05.641977 IP 67-194-197-7.wireless.umnet.umich.edu.58515 > channel-ecmp-05-ash3.facebook.com.https: Flags [P.], seq 13672:14647, ack 5775, win 8192, options [nop,nop,TS val 624083551 ecr 3857659735], length 975
21:47:05.670188 IP channel-ecmp-05-ash3.facebook.com.https > 67-194-197-7.wireless.umnet.umich.edu.58515: Flags [.], ack 14647, win 181, options [nop,nop,TS val 3857659777 ecr 624083551], length 0
21:47:46.025795 IP channel-ecmp-05-ash3.facebook.com.https > 67-194-197-7.wireless.umnet.umich.edu.58515: Flags [P.], seq 5775:6160, ack 14647, win 181, options [nop,nop,TS val 3857700031 ecr 624083551], length 385
21:47:46.026029 IP 67-194-197-7.wireless.umnet.umich.edu.58515 > channel-ecmp-05-ash3.facebook.com.https: Flags [.], ack 6160, win 8167, options [nop,nop,TS val 624123857 ecr 3857700031], length 0
21:47:46.039601 IP 67-194-197-7.wireless.umnet.umich.edu.58515 > channel-ecmp-05-ash3.facebook.com.https: Flags [P.], seq 14647:15622, ack 6160, win 8192, options [nop,nop,TS val 624123870 ecr 3857700031], length 975
21:47:46.068627 IP channel-ecmp-05-ash3.facebook.com.https > 67-194-197-7.wireless.umnet.umich.edu.58515: Flags [.], ack 15622, win 181, options [nop,nop,TS val 3857700175 ecr 624123870], length 0
21:48:26.016990 IP channel-ecmp-05-ash3.facebook.com.https > 67-194-197-7.wireless.umnet.umich.edu.58515: Flags [P.], seq 6160:6545, ack 15622, win 181, options [nop,nop,TS val 3857740063 ecr 624123870], length 385
21:48:26.017254 IP 67-194-197-7.wireless.umnet.umich.edu.58515 > channel-ecmp-05-ash3.facebook.com.https: Flags [.], ack 6545, win 8167, options [nop,nop,TS val 624163776 ecr 3857740063], length 0
21:48:26.031297 IP 67-194-197-7.wireless.umnet.umich.edu.58515 > channel-ecmp-05-ash3.facebook.com.https: Flags [P.], seq 15622:16597, ack 6545, win 8192, options [nop,nop,TS val 624163790 ecr 3857740063], length 975
21:48:26.059876 IP channel-ecmp-05-ash3.facebook.com.https > 67-194-197-7.wireless.umnet.umich.edu.58515: Flags [.], ack 16597, win 181, options [nop,nop,TS val 3857740166 ecr 624163790], length 0
21:49:06.139499 IP channel-ecmp-05-ash3.facebook.com.https > 67-194-197-7.wireless.umnet.umich.edu.58515: Flags [P.], seq 6545:6930, ack 16597, win 181, options [nop,nop,TS val 3857780218 ecr 624163790], length 385
21:49:06.139743 IP 67-194-197-7.wireless.umnet.umich.edu.58515 > channel-ecmp-05-ash3.facebook.com.https: Flags [.], ack 6930, win 8167, options [nop,nop,TS val 624203786 ecr 3857780218], length 0
21:49:06.153805 IP 67-194-197-7.wireless.umnet.umich.edu.58515 > channel-ecmp-05-ash3.facebook.com.https: Flags [P.], seq 16597:17572, ack 6930, win 8192, options [nop,nop,TS val 624203800 ecr 3857780218], length 975
21:49:06.182104 IP channel-ecmp-05-ash3.facebook.com.https > 67-194-197-7.wireless.umnet.umich.edu.58515: Flags [.], ack 17572, win 181, options [nop,nop,TS val 3857780288 ecr 624203800], length 0
21:49:46.248618 IP channel-ecmp-05-ash3.facebook.com.https > 67-194-197-7.wireless.umnet.umich.edu.58515: Flags [P.], seq 6930:7315, ack 17572, win 181, options [nop,nop,TS val 3857820331 ecr 624203800], length 385
21:49:46.248875 IP 67-194-197-7.wireless.umnet.umich.edu.58515 > channel-ecmp-05-ash3.facebook.com.https: Flags [.], ack 7315, win 8167, options [nop,nop,TS val 624243758 ecr 3857820331], length 0
21:49:46.277294 IP 67-194-197-7.wireless.umnet.umich.edu.58515 > channel-ecmp-05-ash3.facebook.com.https: Flags [P.], seq 17572:18547, ack 7315, win 8192, options [nop,nop,TS val 624243786 ecr 3857820331], length 975
21:49:46.305457 IP channel-ecmp-05-ash3.facebook.com.https > 67-194-197-7.wireless.umnet.umich.edu.58515: Flags [.], ack 18547, win 181, options [nop,nop,TS val 3857820412 ecr 624243786], length 0
21:50:26.253247 IP channel-ecmp-05-ash3.facebook.com.https > 67-194-197-7.wireless.umnet.umich.edu.58515: Flags [P.], seq 7315:7700, ack 18547, win 181, options [nop,nop,TS val 3857860257 ecr 624243786], length 385
21:50:26.253496 IP 67-194-197-7.wireless.umnet.umich.edu.58515 > channel-ecmp-05-ash3.facebook.com.https: Flags [.], ack 7700, win 8167, options [nop,nop,TS val 624283713 ecr 3857860257], length 0
21:50:26.266970 IP 67-194-197-7.wireless.umnet.umich.edu.58515 > channel-ecmp-05-ash3.facebook.com.https: Flags [P.], seq 18547:19522, ack 7700, win 8192, options [nop,nop,TS val 624283726 ecr 3857860257], length 975
21:50:26.296176 IP channel-ecmp-05-ash3.facebook.com.https > 67-194-197-7.wireless.umnet.umich.edu.58515: Flags [.], ack 19522, win 181, options [nop,nop,TS val 3857860402 ecr 624283726], length 0
21:51:06.361449 IP channel-ecmp-05-ash3.facebook.com.https > 67-194-197-7.wireless.umnet.umich.edu.58515: Flags [P.], seq 7700:8085, ack 19522, win 181, options [nop,nop,TS val 3857900458 ecr 624283726], length 385
21:51:06.361696 IP 67-194-197-7.wireless.umnet.umich.edu.58515 > channel-ecmp-05-ash3.facebook.com.https: Flags [.], ack 8085, win 8167, options [nop,nop,TS val 624323627 ecr 3857900458], length 0
21:51:06.374842 IP 67-194-197-7.wireless.umnet.umich.edu.58515 > channel-ecmp-05-ash3.facebook.com.https: Flags [P.], seq 19522:20497, ack 8085, win 8192, options [nop,nop,TS val 624323640 ecr 3857900458], length 975
21:51:06.403031 IP channel-ecmp-05-ash3.facebook.com.https > 67-194-197-7.wireless.umnet.umich.edu.58515: Flags [.], ack 20497, win 181, options [nop,nop,TS val 3857900509 ecr 624323640], length 0
21:51:46.676611 IP channel-ecmp-05-ash3.facebook.com.https > 67-194-197-7.wireless.umnet.umich.edu.58515: Flags [P.], seq 8085:8470, ack 20497, win 181, options [nop,nop,TS val 3857940736 ecr 624323640], length 385
21:51:46.676799 IP 67-194-197-7.wireless.umnet.umich.edu.58515 > channel-ecmp-05-ash3.facebook.com.https: Flags [.], ack 8470, win 8167, options [nop,nop,TS val 624363866 ecr 3857940736], length 0
21:51:46.689354 IP 67-194-197-7.wireless.umnet.umich.edu.58515 > channel-ecmp-05-ash3.facebook.com.https: Flags [P.], seq 20497:21472, ack 8470, win 8192, options [nop,nop,TS val 624363878 ecr 3857940736], length 975
21:51:46.717864 IP channel-ecmp-05-ash3.facebook.com.https > 67-194-197-7.wireless.umnet.umich.edu.58515: Flags [.], ack 21472, win 181, options [nop,nop,TS val 3857940824 ecr 624363878], length 0
21:52:26.911752 IP channel-ecmp-05-ash3.facebook.com.https > 67-194-197-7.wireless.umnet.umich.edu.58515: Flags [P.], seq 8470:8855, ack 21472, win 181, options [nop,nop,TS val 3857981018 ecr 624363878], length 385
21:52:26.911865 IP 67-194-197-7.wireless.umnet.umich.edu.58515 > channel-ecmp-05-ash3.facebook.com.https: Flags [.], ack 8855, win 8167, options [nop,nop,TS val 624404042 ecr 3857981018], length 0
21:52:26.925227 IP 67-194-197-7.wireless.umnet.umich.edu.58515 > channel-ecmp-05-ash3.facebook.com.https: Flags [P.], seq 21472:22447, ack 8855, win 8192, options [nop,nop,TS val 624404055 ecr 3857981018], length 975
21:52:26.955594 IP channel-ecmp-05-ash3.facebook.com.https > 67-194-197-7.wireless.umnet.umich.edu.58515: Flags [.], ack 22447, win 181, options [nop,nop,TS val 3857981061 ecr 624404055], length 0
21:53:07.102576 IP channel-ecmp-05-ash3.facebook.com.https > 67-194-197-7.wireless.umnet.umich.edu.58515: Flags [P.], seq 8855:9240, ack 22447, win 181, options [nop,nop,TS val 3858021184 ecr 624404055], length 385
21:53:07.102796 IP 67-194-197-7.wireless.umnet.umich.edu.58515 > channel-ecmp-05-ash3.facebook.com.https: Flags [.], ack 9240, win 8167, options [nop,nop,TS val 624444159 ecr 3858021184], length 0
21:53:07.116584 IP 67-194-197-7.wireless.umnet.umich.edu.58515 > channel-ecmp-05-ash3.facebook.com.https: Flags [P.], seq 22447:23422, ack 9240, win 8192, options [nop,nop,TS val 624444172 ecr 3858021184], length 975
21:53:07.146018 IP channel-ecmp-05-ash3.facebook.com.https > 67-194-197-7.wireless.umnet.umich.edu.58515: Flags [.], ack 23422, win 181, options [nop,nop,TS val 3858021253 ecr 624444172], length 0
21:53:47.420250 IP channel-ecmp-05-ash3.facebook.com.https > 67-194-197-7.wireless.umnet.umich.edu.58515: Flags [P.], seq 9240:9625, ack 23422, win 181, options [nop,nop,TS val 3858061507 ecr 624444172], length 385
21:53:47.420485 IP 67-194-197-7.wireless.umnet.umich.edu.58515 > channel-ecmp-05-ash3.facebook.com.https: Flags [.], ack 9625, win 8167, options [nop,nop,TS val 624484378 ecr 3858061507], length 0
21:53:47.433670 IP 67-194-197-7.wireless.umnet.umich.edu.58515 > channel-ecmp-05-ash3.facebook.com.https: Flags [P.], seq 23422:24397, ack 9625, win 8192, options [nop,nop,TS val 624484391 ecr 3858061507], length 975
21:53:47.461907 IP channel-ecmp-05-ash3.facebook.com.https > 67-194-197-7.wireless.umnet.umich.edu.58515: Flags [.], ack 24397, win 181, options [nop,nop,TS val 3858061568 ecr 624484391], length 0
21:54:26.797198 IP channel-ecmp-05-ash3.facebook.com.https > 67-194-197-7.wireless.umnet.umich.edu.58515: Flags [P.], seq 9625:10010, ack 24397, win 181, options [nop,nop,TS val 3858100875 ecr 624484391], length 385
21:54:26.797361 IP 67-194-197-7.wireless.umnet.umich.edu.58515 > channel-ecmp-05-ash3.facebook.com.https: Flags [.], ack 10010, win 8167, options [nop,nop,TS val 624523722 ecr 3858100875], length 0
21:54:26.812758 IP 67-194-197-7.wireless.umnet.umich.edu.58515 > channel-ecmp-05-ash3.facebook.com.https: Flags [P.], seq 24397:25372, ack 10010, win 8192, options [nop,nop,TS val 624523737 ecr 3858100875], length 975
21:54:26.841622 IP channel-ecmp-05-ash3.facebook.com.https > 67-194-197-7.wireless.umnet.umich.edu.58515: Flags [.], ack 25372, win 181, options [nop,nop,TS val 3858100948 ecr 624523737], length 0
21:55:07.047758 IP channel-ecmp-05-ash3.facebook.com.https > 67-194-197-7.wireless.umnet.umich.edu.58515: Flags [P.], seq 10010:10395, ack 25372, win 181, options [nop,nop,TS val 3858141133 ecr 624523737], length 385
21:55:07.048001 IP 67-194-197-7.wireless.umnet.umich.edu.58515 > channel-ecmp-05-ash3.facebook.com.https: Flags [.], ack 10395, win 8167, options [nop,nop,TS val 624563917 ecr 3858141133], length 0
21:55:07.060597 IP 67-194-197-7.wireless.umnet.umich.edu.58515 > channel-ecmp-05-ash3.facebook.com.https: Flags [P.], seq 25372:26348, ack 10395, win 8192, options [nop,nop,TS val 624563929 ecr 3858141133], length 976
21:55:07.093572 IP channel-ecmp-05-ash3.facebook.com.https > 67-194-197-7.wireless.umnet.umich.edu.58515: Flags [.], ack 26348, win 181, options [nop,nop,TS val 3858141195 ecr 624563929], length 0
21:55:46.911483 IP channel-ecmp-05-ash3.facebook.com.https > 67-194-197-7.wireless.umnet.umich.edu.58515: Flags [P.], seq 10395:10780, ack 26348, win 181, options [nop,nop,TS val 3858180998 ecr 624563929], length 385
21:55:46.911719 IP 67-194-197-7.wireless.umnet.umich.edu.58515 > channel-ecmp-05-ash3.facebook.com.https: Flags [.], ack 10780, win 8167, options [nop,nop,TS val 624603700 ecr 3858180998], length 0
21:55:46.925588 IP 67-194-197-7.wireless.umnet.umich.edu.58515 > channel-ecmp-05-ash3.facebook.com.https: Flags [P.], seq 26348:27324, ack 10780, win 8192, options [nop,nop,TS val 624603713 ecr 3858180998], length 976
21:55:46.953945 IP channel-ecmp-05-ash3.facebook.com.https > 67-194-197-7.wireless.umnet.umich.edu.58515: Flags [.], ack 27324, win 181, options [nop,nop,TS val 3858181060 ecr 624603713], length 0
21:56:27.646077 IP channel-ecmp-05-ash3.facebook.com.https > 67-194-197-7.wireless.umnet.umich.edu.58515: Flags [P.], seq 10780:11165, ack 27324, win 181, options [nop,nop,TS val 3858221742 ecr 624603713], length 385
21:56:27.646300 IP 67-194-197-7.wireless.umnet.umich.edu.58515 > channel-ecmp-05-ash3.facebook.com.https: Flags [.], ack 11165, win 8167, options [nop,nop,TS val 624644395 ecr 3858221742], length 0
21:56:27.659622 IP 67-194-197-7.wireless.umnet.umich.edu.58515 > channel-ecmp-05-ash3.facebook.com.https: Flags [P.], seq 27324:28300, ack 11165, win 8192, options [nop,nop,TS val 624644407 ecr 3858221742], length 976
21:56:27.687644 IP channel-ecmp-05-ash3.facebook.com.https > 67-194-197-7.wireless.umnet.umich.edu.58515: Flags [.], ack 28300, win 181, options [nop,nop,TS val 3858221794 ecr 624644407], length 0
21:57:08.382176 IP channel-ecmp-05-ash3.facebook.com.https > 67-194-197-7.wireless.umnet.umich.edu.58515: Flags [P.], seq 11165:11550, ack 28300, win 181, options [nop,nop,TS val 3858262455 ecr 624644407], length 385
21:57:08.382436 IP 67-194-197-7.wireless.umnet.umich.edu.58515 > channel-ecmp-05-ash3.facebook.com.https: Flags [.], ack 11550, win 8167, options [nop,nop,TS val 624684925 ecr 3858262455], length 0
21:57:08.394399 IP 67-194-197-7.wireless.umnet.umich.edu.58515 > channel-ecmp-05-ash3.facebook.com.https: Flags [P.], seq 28300:29276, ack 11550, win 8192, options [nop,nop,TS val 624684937 ecr 3858262455], length 976
21:57:08.422228 IP channel-ecmp-05-ash3.facebook.com.https > 67-194-197-7.wireless.umnet.umich.edu.58515: Flags [.], ack 29276, win 181, options [nop,nop,TS val 3858262528 ecr 624684937], length 0
21:57:48.431391 IP channel-ecmp-05-ash3.facebook.com.https > 67-194-197-7.wireless.umnet.umich.edu.58515: Flags [P.], seq 11550:11935, ack 29276, win 181, options [nop,nop,TS val 3858302537 ecr 624684937], length 385
21:57:48.431614 IP 67-194-197-7.wireless.umnet.umich.edu.58515 > channel-ecmp-05-ash3.facebook.com.https: Flags [.], ack 11935, win 8167, options [nop,nop,TS val 624724882 ecr 3858302537], length 0
21:57:48.443632 IP 67-194-197-7.wireless.umnet.umich.edu.58515 > channel-ecmp-05-ash3.facebook.com.https: Flags [P.], seq 29276:30252, ack 11935, win 8192, options [nop,nop,TS val 624724894 ecr 3858302537], length 976
21:57:48.472356 IP channel-ecmp-05-ash3.facebook.com.https > 67-194-197-7.wireless.umnet.umich.edu.58515: Flags [.], ack 30252, win 181, options [nop,nop,TS val 3858302578 ecr 624724894], length 0
21:58:28.598788 IP channel-ecmp-05-ash3.facebook.com.https > 67-194-197-7.wireless.umnet.umich.edu.58515: Flags [P.], seq 11935:12320, ack 30252, win 181, options [nop,nop,TS val 3858342668 ecr 624724894], length 385
21:58:28.599014 IP 67-194-197-7.wireless.umnet.umich.edu.58515 > channel-ecmp-05-ash3.facebook.com.https: Flags [.], ack 12320, win 8167, options [nop,nop,TS val 624764993 ecr 3858342668], length 0
21:58:28.610645 IP 67-194-197-7.wireless.umnet.umich.edu.58515 > channel-ecmp-05-ash3.facebook.com.https: Flags [P.], seq 30252:31228, ack 12320, win 8192, options [nop,nop,TS val 624765004 ecr 3858342668], length 976
21:58:28.639202 IP channel-ecmp-05-ash3.facebook.com.https > 67-194-197-7.wireless.umnet.umich.edu.58515: Flags [.], ack 31228, win 181, options [nop,nop,TS val 3858342745 ecr 624765004], length 0
21:59:08.916155 IP channel-ecmp-05-ash3.facebook.com.https > 67-194-197-7.wireless.umnet.umich.edu.58515: Flags [P.], seq 12320:12705, ack 31228, win 181, options [nop,nop,TS val 3858383012 ecr 624765004], length 385
21:59:08.916391 IP 67-194-197-7.wireless.umnet.umich.edu.58515 > channel-ecmp-05-ash3.facebook.com.https: Flags [.], ack 12705, win 8167, options [nop,nop,TS val 624805260 ecr 3858383012], length 0
21:59:08.929903 IP 67-194-197-7.wireless.umnet.umich.edu.58515 > channel-ecmp-05-ash3.facebook.com.https: Flags [P.], seq 31228:32204, ack 12705, win 8192, options [nop,nop,TS val 624805273 ecr 3858383012], length 976
21:59:08.957558 IP channel-ecmp-05-ash3.facebook.com.https > 67-194-197-7.wireless.umnet.umich.edu.58515: Flags [.], ack 32204, win 181, options [nop,nop,TS val 3858383063 ecr 624805273], length 0
21:59:49.546823 IP channel-ecmp-05-ash3.facebook.com.https > 67-194-197-7.wireless.umnet.umich.edu.58515: Flags [P.], seq 12705:13090, ack 32204, win 181, options [nop,nop,TS val 3858423586 ecr 624805273], length 385
21:59:49.547015 IP 67-194-197-7.wireless.umnet.umich.edu.58515 > channel-ecmp-05-ash3.facebook.com.https: Flags [.], ack 13090, win 8167, options [nop,nop,TS val 624845736 ecr 3858423586], length 0
21:59:49.560056 IP 67-194-197-7.wireless.umnet.umich.edu.58515 > channel-ecmp-05-ash3.facebook.com.https: Flags [P.], seq 32204:33180, ack 13090, win 8192, options [nop,nop,TS val 624845749 ecr 3858423586], length 976
21:59:49.589023 IP channel-ecmp-05-ash3.facebook.com.https > 67-194-197-7.wireless.umnet.umich.edu.58515: Flags [.], ack 33180, win 181, options [nop,nop,TS val 3858423694 ecr 624845749], length 0
22:00:29.653597 IP channel-ecmp-05-ash3.facebook.com.https > 67-194-197-7.wireless.umnet.umich.edu.58515: Flags [P.], seq 13090:13475, ack 33180, win 181, options [nop,nop,TS val 3858463674 ecr 624845749], length 385
22:00:29.653824 IP 67-194-197-7.wireless.umnet.umich.edu.58515 > channel-ecmp-05-ash3.facebook.com.https: Flags [.], ack 13475, win 8167, options [nop,nop,TS val 624885787 ecr 3858463674], length 0
22:00:29.668331 IP 67-194-197-7.wireless.umnet.umich.edu.58515 > channel-ecmp-05-ash3.facebook.com.https: Flags [P.], seq 33180:34156, ack 13475, win 8192, options [nop,nop,TS val 624885801 ecr 3858463674], length 976
22:00:29.696861 IP channel-ecmp-05-ash3.facebook.com.https > 67-194-197-7.wireless.umnet.umich.edu.58515: Flags [.], ack 34156, win 181, options [nop,nop,TS val 3858463803 ecr 624885801], length 0
22:01:09.971612 IP channel-ecmp-05-ash3.facebook.com.https > 67-194-197-7.wireless.umnet.umich.edu.58515: Flags [P.], seq 13475:13860, ack 34156, win 181, options [nop,nop,TS val 3858503987 ecr 624885801], length 385
22:01:09.971867 IP 67-194-197-7.wireless.umnet.umich.edu.58515 > channel-ecmp-05-ash3.facebook.com.https: Flags [.], ack 13860, win 8167, options [nop,nop,TS val 624925887 ecr 3858503987], length 0
22:01:09.985375 IP 67-194-197-7.wireless.umnet.umich.edu.58515 > channel-ecmp-05-ash3.facebook.com.https: Flags [P.], seq 34156:35132, ack 13860, win 8192, options [nop,nop,TS val 624925900 ecr 3858503987], length 976
22:01:10.014241 IP channel-ecmp-05-ash3.facebook.com.https > 67-194-197-7.wireless.umnet.umich.edu.58515: Flags [.], ack 35132, win 181, options [nop,nop,TS val 3858504119 ecr 624925900], length 0
22:01:50.499913 IP channel-ecmp-05-ash3.facebook.com.https > 67-194-197-7.wireless.umnet.umich.edu.58515: Flags [P.], seq 13860:14245, ack 35132, win 181, options [nop,nop,TS val 3858544589 ecr 624925900], length 385
22:01:50.500167 IP 67-194-197-7.wireless.umnet.umich.edu.58515 > channel-ecmp-05-ash3.facebook.com.https: Flags [.], ack 14245, win 8167, options [nop,nop,TS val 624966350 ecr 3858544589], length 0
22:01:50.515683 IP 67-194-197-7.wireless.umnet.umich.edu.58515 > channel-ecmp-05-ash3.facebook.com.https: Flags [P.], seq 35132:36108, ack 14245, win 8192, options [nop,nop,TS val 624966365 ecr 3858544589], length 976
22:01:50.544826 IP channel-ecmp-05-ash3.facebook.com.https > 67-194-197-7.wireless.umnet.umich.edu.58515: Flags [.], ack 36108, win 181, options [nop,nop,TS val 3858544650 ecr 624966365], length 0
22:02:29.875878 IP channel-ecmp-05-ash3.facebook.com.https > 67-194-197-7.wireless.umnet.umich.edu.58515: Flags [P.], seq 14245:14630, ack 36108, win 181, options [nop,nop,TS val 3858583955 ecr 624966365], length 385
22:02:29.876130 IP 67-194-197-7.wireless.umnet.umich.edu.58515 > channel-ecmp-05-ash3.facebook.com.https: Flags [.], ack 14630, win 8167, options [nop,nop,TS val 625005667 ecr 3858583955], length 0
22:02:29.887955 IP 67-194-197-7.wireless.umnet.umich.edu.58515 > channel-ecmp-05-ash3.facebook.com.https: Flags [P.], seq 36108:37083, ack 14630, win 8192, options [nop,nop,TS val 625005678 ecr 3858583955], length 975
22:02:29.917019 IP channel-ecmp-05-ash3.facebook.com.https > 67-194-197-7.wireless.umnet.umich.edu.58515: Flags [.], ack 37083, win 181, options [nop,nop,TS val 3858584023 ecr 625005678], length 0
22:03:09.776598 IP channel-ecmp-05-ash3.facebook.com.https > 67-194-197-7.wireless.umnet.umich.edu.58515: Flags [P.], seq 14630:15015, ack 37083, win 181, options [nop,nop,TS val 3858623788 ecr 625005678], length 385
22:03:09.776842 IP 67-194-197-7.wireless.umnet.umich.edu.58515 > channel-ecmp-05-ash3.facebook.com.https: Flags [.], ack 15015, win 8167, options [nop,nop,TS val 625045495 ecr 3858623788], length 0
22:03:09.790500 IP 67-194-197-7.wireless.umnet.umich.edu.58515 > channel-ecmp-05-ash3.facebook.com.https: Flags [P.], seq 37083:38059, ack 15015, win 8192, options [nop,nop,TS val 625045508 ecr 3858623788], length 976
22:03:09.818694 IP channel-ecmp-05-ash3.facebook.com.https > 67-194-197-7.wireless.umnet.umich.edu.58515: Flags [.], ack 38059, win 181, options [nop,nop,TS val 3858623924 ecr 625045508], length 0
22:03:50.614378 IP channel-ecmp-05-ash3.facebook.com.https > 67-194-197-7.wireless.umnet.umich.edu.58515: Flags [P.], seq 15015:15400, ack 38059, win 181, options [nop,nop,TS val 3858664673 ecr 625045508], length 385
22:03:50.614627 IP 67-194-197-7.wireless.umnet.umich.edu.58515 > channel-ecmp-05-ash3.facebook.com.https: Flags [.], ack 15400, win 8167, options [nop,nop,TS val 625086209 ecr 3858664673], length 0
22:03:50.627361 IP 67-194-197-7.wireless.umnet.umich.edu.58515 > channel-ecmp-05-ash3.facebook.com.https: Flags [P.], seq 38059:39035, ack 15400, win 8192, options [nop,nop,TS val 625086221 ecr 3858664673], length 976
22:03:50.655772 IP channel-ecmp-05-ash3.facebook.com.https > 67-194-197-7.wireless.umnet.umich.edu.58515: Flags [.], ack 39035, win 181, options [nop,nop,TS val 3858664761 ecr 625086221], length 0
22:04:31.140683 IP channel-ecmp-05-ash3.facebook.com.https > 67-194-197-7.wireless.umnet.umich.edu.58515: Flags [P.], seq 15400:15785, ack 39035, win 181, options [nop,nop,TS val 3858705234 ecr 625086221], length 385
22:04:31.140904 IP 67-194-197-7.wireless.umnet.umich.edu.58515 > channel-ecmp-05-ash3.facebook.com.https: Flags [.], ack 15785, win 8167, options [nop,nop,TS val 625126681 ecr 3858705234], length 0
22:04:31.153024 IP 67-194-197-7.wireless.umnet.umich.edu.58515 > channel-ecmp-05-ash3.facebook.com.https: Flags [P.], seq 39035:40011, ack 15785, win 8192, options [nop,nop,TS val 625126693 ecr 3858705234], length 976
22:04:31.182022 IP channel-ecmp-05-ash3.facebook.com.https > 67-194-197-7.wireless.umnet.umich.edu.58515: Flags [.], ack 40011, win 181, options [nop,nop,TS val 3858705287 ecr 625126693], length 0
22:05:11.144093 IP channel-ecmp-05-ash3.facebook.com.https > 67-194-197-7.wireless.umnet.umich.edu.58515: Flags [P.], seq 15785:16170, ack 40011, win 181, options [nop,nop,TS val 3858745183 ecr 625126693], length 385
22:05:11.144260 IP 67-194-197-7.wireless.umnet.umich.edu.58515 > channel-ecmp-05-ash3.facebook.com.https: Flags [.], ack 16170, win 8167, options [nop,nop,TS val 625166620 ecr 3858745183], length 0
22:05:11.157134 IP 67-194-197-7.wireless.umnet.umich.edu.58515 > channel-ecmp-05-ash3.facebook.com.https: Flags [P.], seq 40011:40987, ack 16170, win 8192, options [nop,nop,TS val 625166632 ecr 3858745183], length 976
22:05:11.185708 IP channel-ecmp-05-ash3.facebook.com.https > 67-194-197-7.wireless.umnet.umich.edu.58515: Flags [.], ack 40987, win 181, options [nop,nop,TS val 3858745290 ecr 625166632], length 0
22:05:51.150002 IP channel-ecmp-05-ash3.facebook.com.https > 67-194-197-7.wireless.umnet.umich.edu.58515: Flags [P.], seq 16170:16555, ack 40987, win 181, options [nop,nop,TS val 3858785239 ecr 625166632], length 385
22:05:51.150242 IP 67-194-197-7.wireless.umnet.umich.edu.58515 > channel-ecmp-05-ash3.facebook.com.https: Flags [.], ack 16555, win 8167, options [nop,nop,TS val 625206542 ecr 3858785239], length 0
22:05:51.163002 IP 67-194-197-7.wireless.umnet.umich.edu.58515 > channel-ecmp-05-ash3.facebook.com.https: Flags [P.], seq 40987:41963, ack 16555, win 8192, options [nop,nop,TS val 625206554 ecr 3858785239], length 976
22:05:51.191484 IP channel-ecmp-05-ash3.facebook.com.https > 67-194-197-7.wireless.umnet.umich.edu.58515: Flags [.], ack 41963, win 181, options [nop,nop,TS val 3858785297 ecr 625206554], length 0
22:06:31.256716 IP channel-ecmp-05-ash3.facebook.com.https > 67-194-197-7.wireless.umnet.umich.edu.58515: Flags [P.], seq 16555:16940, ack 41963, win 181, options [nop,nop,TS val 3858825263 ecr 625206554], length 385
22:06:31.256948 IP 67-194-197-7.wireless.umnet.umich.edu.58515 > channel-ecmp-05-ash3.facebook.com.https: Flags [.], ack 16940, win 8167, options [nop,nop,TS val 625246615 ecr 3858825263], length 0
22:06:31.269577 IP 67-194-197-7.wireless.umnet.umich.edu.58515 > channel-ecmp-05-ash3.facebook.com.https: Flags [P.], seq 41963:42939, ack 16940, win 8192, options [nop,nop,TS val 625246627 ecr 3858825263], length 976
22:06:31.297670 IP channel-ecmp-05-ash3.facebook.com.https > 67-194-197-7.wireless.umnet.umich.edu.58515: Flags [.], ack 42939, win 181, options [nop,nop,TS val 3858825403 ecr 625246627], length 0
22:07:11.156216 IP channel-ecmp-05-ash3.facebook.com.https > 67-194-197-7.wireless.umnet.umich.edu.58515: Flags [P.], seq 16940:17325, ack 42939, win 181, options [nop,nop,TS val 3858865222 ecr 625246627], length 385
22:07:11.156421 IP 67-194-197-7.wireless.umnet.umich.edu.58515 > channel-ecmp-05-ash3.facebook.com.https: Flags [.], ack 17325, win 8167, options [nop,nop,TS val 625286313 ecr 3858865222], length 0
22:07:11.169316 IP 67-194-197-7.wireless.umnet.umich.edu.58515 > channel-ecmp-05-ash3.facebook.com.https: Flags [P.], seq 42939:43915, ack 17325, win 8192, options [nop,nop,TS val 625286325 ecr 3858865222], length 976
22:07:11.197604 IP channel-ecmp-05-ash3.facebook.com.https > 67-194-197-7.wireless.umnet.umich.edu.58515: Flags [.], ack 43915, win 181, options [nop,nop,TS val 3858865303 ecr 625286325], length 0
22:07:51.160215 IP channel-ecmp-05-ash3.facebook.com.https > 67-194-197-7.wireless.umnet.umich.edu.58515: Flags [P.], seq 17325:17710, ack 43915, win 181, options [nop,nop,TS val 3858905196 ecr 625286325], length 385
22:07:51.160371 IP 67-194-197-7.wireless.umnet.umich.edu.58515 > channel-ecmp-05-ash3.facebook.com.https: Flags [.], ack 17710, win 8167, options [nop,nop,TS val 625326240 ecr 3858905196], length 0
22:07:51.173594 IP 67-194-197-7.wireless.umnet.umich.edu.58515 > channel-ecmp-05-ash3.facebook.com.https: Flags [P.], seq 43915:44891, ack 17710, win 8192, options [nop,nop,TS val 625326253 ecr 3858905196], length 976
22:07:51.202000 IP channel-ecmp-05-ash3.facebook.com.https > 67-194-197-7.wireless.umnet.umich.edu.58515: Flags [.], ack 44891, win 181, options [nop,nop,TS val 3858905307 ecr 625326253], length 0
22:08:30.875800 IP channel-ecmp-05-ash3.facebook.com.https > 67-194-197-7.wireless.umnet.umich.edu.58515: Flags [P.], seq 17710:18095, ack 44891, win 181, options [nop,nop,TS val 3858944981 ecr 625326253], length 385
22:08:30.876036 IP 67-194-197-7.wireless.umnet.umich.edu.58515 > channel-ecmp-05-ash3.facebook.com.https: Flags [.], ack 18095, win 8167, options [nop,nop,TS val 625365900 ecr 3858944981], length 0
22:08:30.889637 IP 67-194-197-7.wireless.umnet.umich.edu.58515 > channel-ecmp-05-ash3.facebook.com.https: Flags [P.], seq 44891:45867, ack 18095, win 8192, options [nop,nop,TS val 625365913 ecr 3858944981], length 976
22:08:30.918225 IP channel-ecmp-05-ash3.facebook.com.https > 67-194-197-7.wireless.umnet.umich.edu.58515: Flags [.], ack 45867, win 181, options [nop,nop,TS val 3858945023 ecr 625365913], length 0
22:09:10.789293 IP channel-ecmp-05-ash3.facebook.com.https > 67-194-197-7.wireless.umnet.umich.edu.58515: Flags [P.], seq 18095:18480, ack 45867, win 181, options [nop,nop,TS val 3858984894 ecr 625365913], length 385
22:09:10.789366 IP 67-194-197-7.wireless.umnet.umich.edu.58515 > channel-ecmp-05-ash3.facebook.com.https: Flags [.], ack 18480, win 8167, options [nop,nop,TS val 625405738 ecr 3858984894], length 0
22:09:10.799247 IP 67-194-197-7.wireless.umnet.umich.edu.58515 > channel-ecmp-05-ash3.facebook.com.https: Flags [P.], seq 45867:46843, ack 18480, win 8192, options [nop,nop,TS val 625405747 ecr 3858984894], length 976
22:09:10.827491 IP channel-ecmp-05-ash3.facebook.com.https > 67-194-197-7.wireless.umnet.umich.edu.58515: Flags [.], ack 46843, win 181, options [nop,nop,TS val 3858984932 ecr 625405747], length 0
22:09:50.963548 IP channel-ecmp-05-ash3.facebook.com.https > 67-194-197-7.wireless.umnet.umich.edu.58515: Flags [P.], seq 18480:18865, ack 46843, win 181, options [nop,nop,TS val 3859024964 ecr 625405747], length 385
