11:25:43.227428 IP 74.125.133.189.443 > 67.194.197.7.49951: Flags [P.], seq 3125284279:3125284334, ack 3128986769, win 1002, options [nop,nop,TS val 1891393771 ecr 588995647], length 55
11:25:43.227605 IP 74.125.133.189.443 > 67.194.197.7.49951: Flags [P.], seq 55:88, ack 1, win 1002, options [nop,nop,TS val 1891393771 ecr 588995647], length 33
11:25:43.227621 IP 67.194.197.7.49951 > 74.125.133.189.443: Flags [.], ack 55, win 8188, options [nop,nop,TS val 589019699 ecr 1891393771], length 0
11:25:43.227671 IP 67.194.197.7.49951 > 74.125.133.189.443: Flags [.], ack 88, win 8189, options [nop,nop,TS val 589019699 ecr 1891393771], length 0
11:25:43.234550 IP 67.194.197.7.49951 > 74.125.133.189.443: Flags [.], seq 1:1419, ack 88, win 8192, options [nop,nop,TS val 589019705 ecr 1891393771], length 1418
11:25:43.234552 IP 67.194.197.7.49951 > 74.125.133.189.443: Flags [P.], seq 1419:2737, ack 88, win 8192, options [nop,nop,TS val 589019705 ecr 1891393771], length 1318
11:25:43.253325 IP 74.125.133.189.443 > 67.194.197.7.49951: Flags [.], ack 1419, win 1002, options [nop,nop,TS val 1891393840 ecr 589019705], length 0
11:25:43.253803 IP 74.125.133.189.443 > 67.194.197.7.49951: Flags [.], ack 2737, win 1002, options [nop,nop,TS val 1891393840 ecr 589019705], length 0
11:25:43.354536 IP 74.125.133.189.443 > 67.194.197.7.49951: Flags [P.], seq 88:139, ack 2737, win 1002, options [nop,nop,TS val 1891393938 ecr 589019705], length 51
11:25:43.354723 IP 67.194.197.7.49951 > 74.125.133.189.443: Flags [.], ack 139, win 8188, options [nop,nop,TS val 589019822 ecr 1891393938], length 0
11:25:43.355461 IP 74.125.133.189.443 > 67.194.197.7.49951: Flags [P.], seq 139:194, ack 2737, win 1002, options [nop,nop,TS val 1891393939 ecr 589019705], length 55
11:25:43.355548 IP 67.194.197.7.49951 > 74.125.133.189.443: Flags [.], ack 194, win 8188, options [nop,nop,TS val 589019822 ecr 1891393939], length 0
11:25:47.823124 IP 74.125.133.189.443 > 67.194.197.7.49951: Flags [P.], seq 194:249, ack 2737, win 1002, options [nop,nop,TS val 1891398285 ecr 589019822], length 55
11:25:47.823289 IP 67.194.197.7.49951 > 74.125.133.189.443: Flags [.], ack 249, win 8188, options [nop,nop,TS val 589024278 ecr 1891398285], length 0
11:26:11.532920 IP 74.125.133.189.443 > 67.194.197.7.49951: Flags [P.], seq 249:304, ack 2737, win 1002, options [nop,nop,TS val 1891422075 ecr 589024278], length 55
11:26:11.533094 IP 67.194.197.7.49951 > 74.125.133.189.443: Flags [.], ack 304, win 8188, options [nop,nop,TS val 589047945 ecr 1891422075], length 0
11:26:13.830841 IP 74.125.133.189.443 > 67.194.197.7.49951: Flags [P.], seq 304:359, ack 2737, win 1002, options [nop,nop,TS val 1891424322 ecr 589047945], length 55
11:26:13.831010 IP 67.194.197.7.49951 > 74.125.133.189.443: Flags [.], ack 359, win 8188, options [nop,nop,TS val 589050232 ecr 1891424322], length 0
11:26:13.840374 IP 67.194.197.7.49951 > 74.125.133.189.443: Flags [.], seq 2737:4155, ack 359, win 8192, options [nop,nop,TS val 589050241 ecr 1891424322], length 1418
11:26:13.840376 IP 67.194.197.7.49951 > 74.125.133.189.443: Flags [.], seq 4155:5573, ack 359, win 8192, options [nop,nop,TS val 589050241 ecr 1891424322], length 1418
11:26:13.840378 IP 67.194.197.7.49951 > 74.125.133.189.443: Flags [P.], seq 5573:6213, ack 359, win 8192, options [nop,nop,TS val 589050241 ecr 1891424322], length 640
11:26:13.861437 IP 74.125.133.189.443 > 67.194.197.7.49951: Flags [.], ack 4155, win 1002, options [nop,nop,TS val 1891424448 ecr 589050241], length 0
11:26:13.862892 IP 74.125.133.189.443 > 67.194.197.7.49951: Flags [.], ack 5573, win 1002, options [nop,nop,TS val 1891424449 ecr 589050241], length 0
11:26:13.863788 IP 74.125.133.189.443 > 67.194.197.7.49951: Flags [.], ack 6213, win 992, options [nop,nop,TS val 1891424449 ecr 589050241], length 0
11:26:13.945119 IP 74.125.133.189.443 > 67.194.197.7.49951: Flags [P.], seq 359:411, ack 6213, win 1002, options [nop,nop,TS val 1891424531 ecr 589050241], length 52
11:26:13.945248 IP 67.194.197.7.49951 > 74.125.133.189.443: Flags [.], ack 411, win 8188, options [nop,nop,TS val 589050344 ecr 1891424531], length 0
11:26:13.945677 IP 74.125.133.189.443 > 67.194.197.7.49951: Flags [P.], seq 411:466, ack 6213, win 1002, options [nop,nop,TS val 1891424531 ecr 589050241], length 55
11:26:13.945774 IP 67.194.197.7.49951 > 74.125.133.189.443: Flags [.], ack 466, win 8188, options [nop,nop,TS val 589050344 ecr 1891424531], length 0
11:26:37.409159 IP 74.125.133.189.443 > 67.194.197.7.49951: Flags [P.], seq 466:521, ack 6213, win 1002, options [nop,nop,TS val 1891447995 ecr 589050344], length 55
11:26:37.409326 IP 67.194.197.7.49951 > 74.125.133.189.443: Flags [.], ack 521, win 8188, options [nop,nop,TS val 589073746 ecr 1891447995], length 0
11:26:37.417332 IP 67.194.197.7.49951 > 74.125.133.189.443: Flags [.], seq 6213:7631, ack 521, win 8192, options [nop,nop,TS val 589073754 ecr 1891447995], length 1418
11:26:37.417333 IP 67.194.197.7.49951 > 74.125.133.189.443: Flags [P.], seq 7631:8950, ack 521, win 8192, options [nop,nop,TS val 589073754 ecr 1891447995], length 1319
11:26:37.436437 IP 74.125.133.189.443 > 67.194.197.7.49951: Flags [.], ack 7631, win 1002, options [nop,nop,TS val 1891448023 ecr 589073754], length 0
11:26:37.436973 IP 74.125.133.189.443 > 67.194.197.7.49951: Flags [.], ack 8950, win 1002, options [nop,nop,TS val 1891448023 ecr 589073754], length 0
11:26:37.489809 IP 74.125.133.189.443 > 67.194.197.7.49951: Flags [P.], seq 521:572, ack 8950, win 1002, options [nop,nop,TS val 1891448076 ecr 589073754], length 51
11:26:37.489969 IP 67.194.197.7.49951 > 74.125.133.189.443: Flags [.], ack 572, win 8188, options [nop,nop,TS val 589073826 ecr 1891448076], length 0
11:26:37.490327 IP 74.125.133.189.443 > 67.194.197.7.49951: Flags [P.], seq 572:627, ack 8950, win 1002, options [nop,nop,TS val 1891448076 ecr 589073754], length 55
11:26:37.490400 IP 67.194.197.7.49951 > 74.125.133.189.443: Flags [.], ack 627, win 8188, options [nop,nop,TS val 589073826 ecr 1891448076], length 0
11:26:39.211707 IP 74.125.133.189.443 > 67.194.197.7.49951: Flags [P.], seq 627:682, ack 8950, win 1002, options [nop,nop,TS val 1891449732 ecr 589073826], length 55
11:26:39.211815 IP 67.194.197.7.49951 > 74.125.133.189.443: Flags [.], ack 682, win 8188, options [nop,nop,TS val 589075541 ecr 1891449732], length 0
11:27:02.608175 IP 74.125.133.189.443 > 67.194.197.7.49951: Flags [P.], seq 682:737, ack 8950, win 1002, options [nop,nop,TS val 1891473119 ecr 589075541], length 55
11:27:02.608348 IP 67.194.197.7.49951 > 74.125.133.189.443: Flags [.], ack 737, win 8188, options [nop,nop,TS val 589098864 ecr 1891473119], length 0
11:27:06.577245 IP 74.125.133.189.443 > 67.194.197.7.49951: Flags [P.], seq 737:792, ack 8950, win 1002, options [nop,nop,TS val 1891477089 ecr 589098864], length 55
11:27:06.577370 IP 67.194.197.7.49951 > 74.125.133.189.443: Flags [.], ack 792, win 8188, options [nop,nop,TS val 589102827 ecr 1891477089], length 0
11:27:06.587287 IP 67.194.197.7.49951 > 74.125.133.189.443: Flags [.], seq 8950:10368, ack 792, win 8192, options [nop,nop,TS val 589102836 ecr 1891477089], length 1418
11:27:06.587289 IP 67.194.197.7.49951 > 74.125.133.189.443: Flags [.], seq 10368:11786, ack 792, win 8192, options [nop,nop,TS val 589102836 ecr 1891477089], length 1418
11:27:06.587290 IP 67.194.197.7.49951 > 74.125.133.189.443: Flags [P.], seq 11786:12426, ack 792, win 8192, options [nop,nop,TS val 589102836 ecr 1891477089], length 640
11:27:06.605968 IP 74.125.133.189.443 > 67.194.197.7.49951: Flags [.], ack 10368, win 1002, options [nop,nop,TS val 1891477192 ecr 589102836], length 0
11:27:06.606782 IP 74.125.133.189.443 > 67.194.197.7.49951: Flags [.], ack 11786, win 1002, options [nop,nop,TS val 1891477193 ecr 589102836], length 0
11:27:06.607335 IP 74.125.133.189.443 > 67.194.197.7.49951: Flags [.], ack 12426, win 992, options [nop,nop,TS val 1891477193 ecr 589102836], length 0
11:27:06.660128 IP 74.125.133.189.443 > 67.194.197.7.49951: Flags [P.], seq 792:845, ack 12426, win 1002, options [nop,nop,TS val 1891477246 ecr 589102836], length 53
11:27:06.660290 IP 67.194.197.7.49951 > 74.125.133.189.443: Flags [.], ack 845, win 8188, options [nop,nop,TS val 589102907 ecr 1891477246], length 0
11:27:06.660579 IP 74.125.133.189.443 > 67.194.197.7.49951: Flags [P.], seq 845:900, ack 12426, win 1002, options [nop,nop,TS val 1891477246 ecr 589102836], length 55
11:27:06.660668 IP 67.194.197.7.49951 > 74.125.133.189.443: Flags [.], ack 900, win 8188, options [nop,nop,TS val 589102907 ecr 1891477246], length 0
11:27:27.467064 IP 74.125.133.189.443 > 67.194.197.7.49951: Flags [P.], seq 900:955, ack 12426, win 1002, options [nop,nop,TS val 1891497977 ecr 589102907], length 55
11:27:27.467260 IP 67.194.197.7.49951 > 74.125.133.189.443: Flags [.], ack 955, win 8188, options [nop,nop,TS val 589123641 ecr 1891497977], length 0
11:27:27.475406 IP 67.194.197.7.49951 > 74.125.133.189.443: Flags [.], seq 12426:13844, ack 955, win 8192, options [nop,nop,TS val 589123649 ecr 1891497977], length 1418
11:27:27.475409 IP 67.194.197.7.49951 > 74.125.133.189.443: Flags [P.], seq 13844:15163, ack 955, win 8192, options [nop,nop,TS val 589123649 ecr 1891497977], length 1319
11:27:27.496742 IP 74.125.133.189.443 > 67.194.197.7.49951: Flags [.], ack 13844, win 1002, options [nop,nop,TS val 1891498080 ecr 589123649], length 0
11:27:27.529313 IP 74.125.133.189.443 > 67.194.197.7.49951: Flags [.], ack 15163, win 1002, options [nop,nop,TS val 1891498115 ecr 589123649], length 0
11:27:27.580921 IP 74.125.133.189.443 > 67.194.197.7.49951: Flags [P.], seq 955:1005, ack 15163, win 1002, options [nop,nop,TS val 1891498167 ecr 589123649], length 50
11:27:27.580994 IP 74.125.133.189.443 > 67.194.197.7.49951: Flags [P.], seq 1005:1060, ack 15163, win 1002, options [nop,nop,TS val 1891498167 ecr 589123649], length 55
11:27:27.581077 IP 67.194.197.7.49951 > 74.125.133.189.443: Flags [.], ack 1005, win 8188, options [nop,nop,TS val 589123752 ecr 1891498167], length 0
11:27:27.581079 IP 67.194.197.7.49951 > 74.125.133.189.443: Flags [.], ack 1060, win 8188, options [nop,nop,TS val 589123752 ecr 1891498167], length 0
11:27:36.658365 IP 74.125.133.189.443 > 67.194.197.7.49951: Flags [P.], seq 1060:1115, ack 15163, win 1002, options [nop,nop,TS val 1891507210 ecr 589123752], length 55
11:27:36.658561 IP 67.194.197.7.49951 > 74.125.133.189.443: Flags [.], ack 1115, win 8188, options [nop,nop,TS val 589132808 ecr 1891507210], length 0
11:27:57.234714 IP 74.125.133.189.443 > 67.194.197.7.49951: Flags [P.], seq 1115:1170, ack 15163, win 1002, options [nop,nop,TS val 1891527723 ecr 589132808], length 55
11:27:57.234901 IP 67.194.197.7.49951 > 74.125.133.189.443: Flags [.], ack 1170, win 8188, options [nop,nop,TS val 589153327 ecr 1891527723], length 0
11:28:04.859442 IP 74.125.133.189.443 > 67.194.197.7.49951: Flags [P.], seq 1170:1225, ack 15163, win 1002, options [nop,nop,TS val 1891534967 ecr 589153327], length 55
11:28:04.859622 IP 67.194.197.7.49951 > 74.125.133.189.443: Flags [.], ack 1225, win 8188, options [nop,nop,TS val 589160944 ecr 1891534967], length 0
11:28:04.859874 IP 74.125.133.189.443 > 67.194.197.7.49951: Flags [P.], seq 1170:1225, ack 15163, win 1002, options [nop,nop,TS val 1891535227 ecr 589153327], length 55
11:28:04.859931 IP 67.194.197.7.49951 > 74.125.133.189.443: Flags [.], ack 1225, win 8192, options [nop,nop,TS val 589160944 ecr 1891535227], length 0
11:28:04.868649 IP 67.194.197.7.49951 > 74.125.133.189.443: Flags [.], seq 15163:16581, ack 1225, win 8192, options [nop,nop,TS val 589160953 ecr 1891535227], length 1418
11:28:04.868652 IP 67.194.197.7.49951 > 74.125.133.189.443: Flags [.], seq 16581:17999, ack 1225, win 8192, options [nop,nop,TS val 589160953 ecr 1891535227], length 1418
11:28:04.868653 IP 67.194.197.7.49951 > 74.125.133.189.443: Flags [P.], seq 17999:18639, ack 1225, win 8192, options [nop,nop,TS val 589160953 ecr 1891535227], length 640
11:28:04.890004 IP 74.125.133.189.443 > 67.194.197.7.49951: Flags [.], ack 17999, win 1002, options [nop,nop,TS val 1891535476 ecr 589160953], length 0
11:28:04.933676 IP 74.125.133.189.443 > 67.194.197.7.49951: Flags [.], ack 18639, win 1002, options [nop,nop,TS val 1891535519 ecr 589160953], length 0
11:28:04.983656 IP 74.125.133.189.443 > 67.194.197.7.49951: Flags [P.], seq 1225:1278, ack 18639, win 1002, options [nop,nop,TS val 1891535570 ecr 589160953], length 53
11:28:04.983813 IP 67.194.197.7.49951 > 74.125.133.189.443: Flags [.], ack 1278, win 8188, options [nop,nop,TS val 589161066 ecr 1891535570], length 0
11:28:04.984112 IP 74.125.133.189.443 > 67.194.197.7.49951: Flags [P.], seq 1278:1333, ack 18639, win 1002, options [nop,nop,TS val 1891535570 ecr 589160953], length 55
11:28:04.984247 IP 67.194.197.7.49951 > 74.125.133.189.443: Flags [.], ack 1333, win 8188, options [nop,nop,TS val 589161066 ecr 1891535570], length 0
11:28:25.017909 IP 74.125.133.189.443 > 67.194.197.7.49951: Flags [P.], seq 1333:1388, ack 18639, win 1002, options [nop,nop,TS val 1891555412 ecr 589161066], length 55
11:28:25.018085 IP 67.194.197.7.49951 > 74.125.133.189.443: Flags [.], ack 1388, win 8188, options [nop,nop,TS val 589181050 ecr 1891555412], length 0
11:28:25.026646 IP 67.194.197.7.49951 > 74.125.133.189.443: Flags [.], seq 18639:20057, ack 1388, win 8192, options [nop,nop,TS val 589181058 ecr 1891555412], length 1418
11:28:25.026648 IP 67.194.197.7.49951 > 74.125.133.189.443: Flags [P.], seq 20057:21376, ack 1388, win 8192, options [nop,nop,TS val 589181058 ecr 1891555412], length 1319
11:28:25.045387 IP 74.125.133.189.443 > 67.194.197.7.49951: Flags [.], ack 20057, win 1002, options [nop,nop,TS val 1891555631 ecr 589181058], length 0
11:28:25.046117 IP 74.125.133.189.443 > 67.194.197.7.49951: Flags [.], ack 21376, win 1002, options [nop,nop,TS val 1891555632 ecr 589181058], length 0
11:28:25.102433 IP 74.125.133.189.443 > 67.194.197.7.49951: Flags [P.], seq 1388:1438, ack 21376, win 1002, options [nop,nop,TS val 1891555687 ecr 589181058], length 50
11:28:25.102592 IP 67.194.197.7.49951 > 74.125.133.189.443: Flags [.], ack 1438, win 8188, options [nop,nop,TS val 589181133 ecr 1891555687], length 0
11:28:25.102766 IP 74.125.133.189.443 > 67.194.197.7.49951: Flags [P.], seq 1438:1493, ack 21376, win 1002, options [nop,nop,TS val 1891555687 ecr 589181058], length 55
11:28:25.102858 IP 67.194.197.7.49951 > 74.125.133.189.443: Flags [.], ack 1493, win 8188, options [nop,nop,TS val 589181133 ecr 1891555687], length 0
11:28:31.076746 IP 74.125.133.189.443 > 67.194.197.7.49951: Flags [P.], seq 1493:1548, ack 21376, win 1002, options [nop,nop,TS val 1891561501 ecr 589181133], length 55
11:28:31.076920 IP 67.194.197.7.49951 > 74.125.133.189.443: Flags [.], ack 1548, win 8188, options [nop,nop,TS val 589187090 ecr 1891561501], length 0
11:28:53.323680 IP 74.125.133.189.443 > 67.194.197.7.49951: Flags [P.], seq 1548:1603, ack 21376, win 1002, options [nop,nop,TS val 1891583748 ecr 589187090], length 55
11:28:53.323860 IP 67.194.197.7.49951 > 74.125.133.189.443: Flags [.], ack 1603, win 8188, options [nop,nop,TS val 589209266 ecr 1891583748], length 0
11:28:55.203617 IP 74.125.133.189.443 > 67.194.197.7.49951: Flags [P.], seq 1603:1658, ack 21376, win 1002, options [nop,nop,TS val 1891585695 ecr 589209266], length 55
11:28:55.203745 IP 67.194.197.7.49951 > 74.125.133.189.443: Flags [.], ack 1658, win 8188, options [nop,nop,TS val 589211144 ecr 1891585695], length 0
11:28:55.214160 IP 67.194.197.7.49951 > 74.125.133.189.443: Flags [.], seq 21376:22794, ack 1658, win 8192, options [nop,nop,TS val 589211154 ecr 1891585695], length 1418
11:28:55.214161 IP 67.194.197.7.49951 > 74.125.133.189.443: Flags [.], seq 22794:24212, ack 1658, win 8192, options [nop,nop,TS val 589211154 ecr 1891585695], length 1418
11:28:55.214162 IP 67.194.197.7.49951 > 74.125.133.189.443: Flags [P.], seq 24212:24852, ack 1658, win 8192, options [nop,nop,TS val 589211154 ecr 1891585695], length 640
11:28:55.232928 IP 74.125.133.189.443 > 67.194.197.7.49951: Flags [.], ack 22794, win 1002, options [nop,nop,TS val 1891585819 ecr 589211154], length 0
11:28:55.233583 IP 74.125.133.189.443 > 67.194.197.7.49951: Flags [.], ack 24212, win 1002, options [nop,nop,TS val 1891585820 ecr 589211154], length 0
11:28:55.233961 IP 74.125.133.189.443 > 67.194.197.7.49951: Flags [.], ack 24852, win 992, options [nop,nop,TS val 1891585820 ecr 589211154], length 0
11:28:55.286546 IP 74.125.133.189.443 > 67.194.197.7.49951: Flags [P.], seq 1658:1709, ack 24852, win 1002, options [nop,nop,TS val 1891585872 ecr 589211154], length 51
11:28:55.286703 IP 67.194.197.7.49951 > 74.125.133.189.443: Flags [.], ack 1709, win 8188, options [nop,nop,TS val 589211225 ecr 1891585872], length 0
11:28:55.287898 IP 74.125.133.189.443 > 67.194.197.7.49951: Flags [P.], seq 1709:1764, ack 24852, win 1002, options [nop,nop,TS val 1891585872 ecr 589211154], length 55
11:28:55.287991 IP 67.194.197.7.49951 > 74.125.133.189.443: Flags [.], ack 1764, win 8188, options [nop,nop,TS val 589211226 ecr 1891585872], length 0
11:29:18.704409 IP 74.125.133.189.443 > 67.194.197.7.49951: Flags [P.], seq 1764:1819, ack 24852, win 1002, options [nop,nop,TS val 1891609086 ecr 589211226], length 55
11:29:18.704521 IP 67.194.197.7.49951 > 74.125.133.189.443: Flags [.], ack 1819, win 8188, options [nop,nop,TS val 589234584 ecr 1891609086], length 0
11:29:18.711990 IP 67.194.197.7.49951 > 74.125.133.189.443: Flags [.], seq 24852:26270, ack 1819, win 8192, options [nop,nop,TS val 589234591 ecr 1891609086], length 1418
11:29:18.711992 IP 67.194.197.7.49951 > 74.125.133.189.443: Flags [P.], seq 26270:27589, ack 1819, win 8192, options [nop,nop,TS val 589234591 ecr 1891609086], length 1319
11:29:18.731412 IP 74.125.133.189.443 > 67.194.197.7.49951: Flags [.], ack 26270, win 1002, options [nop,nop,TS val 1891609317 ecr 589234591], length 0
11:29:18.732787 IP 74.125.133.189.443 > 67.194.197.7.49951: Flags [.], ack 27589, win 1002, options [nop,nop,TS val 1891609319 ecr 589234591], length 0
11:29:18.787140 IP 74.125.133.189.443 > 67.194.197.7.49951: Flags [P.], seq 1819:1872, ack 27589, win 1002, options [nop,nop,TS val 1891609373 ecr 589234591], length 53
11:29:18.787314 IP 67.194.197.7.49951 > 74.125.133.189.443: Flags [.], ack 1872, win 8188, options [nop,nop,TS val 589234665 ecr 1891609373], length 0
11:29:18.787522 IP 74.125.133.189.443 > 67.194.197.7.49951: Flags [P.], seq 1872:1927, ack 27589, win 1002, options [nop,nop,TS val 1891609373 ecr 589234591], length 55
11:29:18.787626 IP 67.194.197.7.49951 > 74.125.133.189.443: Flags [.], ack 1927, win 8188, options [nop,nop,TS val 589234665 ecr 1891609373], length 0
11:29:21.002501 IP 74.125.133.189.443 > 67.194.197.7.49951: Flags [P.], seq 1927:1982, ack 27589, win 1002, options [nop,nop,TS val 1891611497 ecr 589234665], length 55
11:29:21.002641 IP 67.194.197.7.49951 > 74.125.133.189.443: Flags [.], ack 1982, win 8188, options [nop,nop,TS val 589236872 ecr 1891611497], length 0
11:29:46.072423 IP 74.125.133.189.443 > 67.194.197.7.49951: Flags [P.], seq 1982:2037, ack 27589, win 1002, options [nop,nop,TS val 1891636411 ecr 589236872], length 55
11:29:46.072619 IP 67.194.197.7.49951 > 74.125.133.189.443: Flags [.], ack 2037, win 8188, options [nop,nop,TS val 589261909 ecr 1891636411], length 0
11:29:46.072938 IP 74.125.133.189.443 > 67.194.197.7.49951: Flags [P.], seq 2037:2070, ack 27589, win 1002, options [nop,nop,TS val 1891636411 ecr 589236872], length 33
11:29:46.073120 IP 67.194.197.7.49951 > 74.125.133.189.443: Flags [.], ack 2070, win 8189, options [nop,nop,TS val 589261909 ecr 1891636411], length 0
11:29:46.081849 IP 67.194.197.7.49951 > 74.125.133.189.443: Flags [.], seq 27589:29007, ack 2070, win 8192, options [nop,nop,TS val 589261917 ecr 1891636411], length 1418
11:29:46.081851 IP 67.194.197.7.49951 > 74.125.133.189.443: Flags [.], seq 29007:30425, ack 2070, win 8192, options [nop,nop,TS val 589261917 ecr 1891636411], length 1418
11:29:46.081852 IP 67.194.197.7.49951 > 74.125.133.189.443: Flags [P.], seq 30425:31064, ack 2070, win 8192, options [nop,nop,TS val 589261917 ecr 1891636411], length 639
11:29:46.100858 IP 74.125.133.189.443 > 67.194.197.7.49951: Flags [.], ack 29007, win 1002, options [nop,nop,TS val 1891636687 ecr 589261917], length 0
11:29:46.102869 IP 74.125.133.189.443 > 67.194.197.7.49951: Flags [.], ack 30425, win 1002, options [nop,nop,TS val 1891636687 ecr 589261917], length 0
11:29:46.103171 IP 74.125.133.189.443 > 67.194.197.7.49951: Flags [.], ack 31064, win 993, options [nop,nop,TS val 1891636687 ecr 589261917], length 0
11:29:46.192670 IP 74.125.133.189.443 > 67.194.197.7.49951: Flags [P.], seq 2070:2121, ack 31064, win 1002, options [nop,nop,TS val 1891636779 ecr 589261917], length 51
11:29:46.192862 IP 67.194.197.7.49951 > 74.125.133.189.443: Flags [.], ack 2121, win 8188, options [nop,nop,TS val 589262026 ecr 1891636779], length 0
11:29:46.196445 IP 74.125.133.189.443 > 67.194.197.7.49951: Flags [P.], seq 2121:2176, ack 31064, win 1002, options [nop,nop,TS val 1891636779 ecr 589261917], length 55
11:29:46.196616 IP 67.194.197.7.49951 > 74.125.133.189.443: Flags [.], ack 2176, win 8188, options [nop,nop,TS val 589262029 ecr 1891636779], length 0
11:29:46.395362 IP 74.125.133.189.443 > 67.194.197.7.49951: Flags [P.], seq 2176:2231, ack 31064, win 1002, options [nop,nop,TS val 1891636981 ecr 589262029], length 55
11:29:46.395532 IP 67.194.197.7.49951 > 74.125.133.189.443: Flags [.], ack 2231, win 8188, options [nop,nop,TS val 589262227 ecr 1891636981], length 0
11:30:13.957790 IP 74.125.133.189.443 > 67.194.197.7.49951: Flags [P.], seq 2231:2286, ack 31064, win 1002, options [nop,nop,TS val 1891664494 ecr 589262227], length 55
11:30:13.957967 IP 67.194.197.7.49951 > 74.125.133.189.443: Flags [.], ack 2286, win 8188, options [nop,nop,TS val 589289732 ecr 1891664494], length 0
11:30:14.375354 IP 74.125.133.189.443 > 67.194.197.7.49951: Flags [P.], seq 2286:2341, ack 31064, win 1002, options [nop,nop,TS val 1891664934 ecr 589289732], length 55
11:30:14.375470 IP 67.194.197.7.49951 > 74.125.133.189.443: Flags [.], ack 2341, win 8188, options [nop,nop,TS val 589290147 ecr 1891664934], length 0
11:30:14.383286 IP 67.194.197.7.49951 > 74.125.133.189.443: Flags [.], seq 31064:32482, ack 2341, win 8192, options [nop,nop,TS val 589290154 ecr 1891664934], length 1418
11:30:14.383288 IP 67.194.197.7.49951 > 74.125.133.189.443: Flags [P.], seq 32482:33801, ack 2341, win 8192, options [nop,nop,TS val 589290154 ecr 1891664934], length 1319
11:30:14.403261 IP 74.125.133.189.443 > 67.194.197.7.49951: Flags [.], ack 32482, win 1002, options [nop,nop,TS val 1891664989 ecr 589290154], length 0
11:30:14.405525 IP 74.125.133.189.443 > 67.194.197.7.49951: Flags [.], ack 33801, win 1002, options [nop,nop,TS val 1891664991 ecr 589290154], length 0
11:30:14.457697 IP 74.125.133.189.443 > 67.194.197.7.49951: Flags [P.], seq 2341:2395, ack 33801, win 1002, options [nop,nop,TS val 1891665044 ecr 589290154], length 54
11:30:14.457854 IP 67.194.197.7.49951 > 74.125.133.189.443: Flags [.], ack 2395, win 8188, options [nop,nop,TS val 589290227 ecr 1891665044], length 0
11:30:14.458072 IP 74.125.133.189.443 > 67.194.197.7.49951: Flags [P.], seq 2395:2450, ack 33801, win 1002, options [nop,nop,TS val 1891665044 ecr 589290154], length 55
11:30:14.458222 IP 67.194.197.7.49951 > 74.125.133.189.443: Flags [.], ack 2450, win 8188, options [nop,nop,TS val 589290227 ecr 1891665044], length 0
11:30:38.294349 IP 74.125.133.189.443 > 67.194.197.7.49951: Flags [P.], seq 2450:2505, ack 33801, win 1002, options [nop,nop,TS val 1891688805 ecr 589290227], length 55
11:30:38.294475 IP 67.194.197.7.49951 > 74.125.133.189.443: Flags [.], ack 2505, win 8188, options [nop,nop,TS val 589314020 ecr 1891688805], length 0
11:30:38.294712 IP 74.125.133.189.443 > 67.194.197.7.49951: Flags [P.], seq 2505:2538, ack 33801, win 1002, options [nop,nop,TS val 1891688805 ecr 589290227], length 33
11:30:38.294840 IP 67.194.197.7.49951 > 74.125.133.189.443: Flags [.], ack 2538, win 8189, options [nop,nop,TS val 589314020 ecr 1891688805], length 0
11:30:38.305737 IP 67.194.197.7.49951 > 74.125.133.189.443: Flags [.], seq 33801:35219, ack 2538, win 8192, options [nop,nop,TS val 589314031 ecr 1891688805], length 1418
11:30:38.305739 IP 67.194.197.7.49951 > 74.125.133.189.443: Flags [.], seq 35219:36637, ack 2538, win 8192, options [nop,nop,TS val 589314031 ecr 1891688805], length 1418
11:30:38.305740 IP 67.194.197.7.49951 > 74.125.133.189.443: Flags [P.], seq 36637:37277, ack 2538, win 8192, options [nop,nop,TS val 589314031 ecr 1891688805], length 640
11:30:38.324692 IP 74.125.133.189.443 > 67.194.197.7.49951: Flags [.], ack 35219, win 1002, options [nop,nop,TS val 1891688911 ecr 589314031], length 0
11:30:38.325542 IP 74.125.133.189.443 > 67.194.197.7.49951: Flags [.], ack 36637, win 1002, options [nop,nop,TS val 1891688912 ecr 589314031], length 0
11:30:38.325928 IP 74.125.133.189.443 > 67.194.197.7.49951: Flags [.], ack 37277, win 992, options [nop,nop,TS val 1891688912 ecr 589314031], length 0
11:30:38.377302 IP 74.125.133.189.443 > 67.194.197.7.49951: Flags [P.], seq 2538:2589, ack 37277, win 1002, options [nop,nop,TS val 1891688963 ecr 589314031], length 51
11:30:38.377380 IP 67.194.197.7.49951 > 74.125.133.189.443: Flags [.], ack 2589, win 8188, options [nop,nop,TS val 589314102 ecr 1891688963], length 0
11:30:38.377679 IP 74.125.133.189.443 > 67.194.197.7.49951: Flags [P.], seq 2589:2644, ack 37277, win 1002, options [nop,nop,TS val 1891688963 ecr 589314031], length 55
11:30:38.377736 IP 67.194.197.7.49951 > 74.125.133.189.443: Flags [.], ack 2644, win 8188, options [nop,nop,TS val 589314102 ecr 1891688963], length 0
11:30:42.470453 IP 74.125.133.189.443 > 67.194.197.7.49951: Flags [P.], seq 2644:2699, ack 37277, win 1002, options [nop,nop,TS val 1891692999 ecr 589314102], length 55
11:30:42.470624 IP 67.194.197.7.49951 > 74.125.133.189.443: Flags [.], ack 2699, win 8188, options [nop,nop,TS val 589318185 ecr 1891692999], length 0
11:31:04.404340 IP 74.125.133.189.443 > 67.194.197.7.49951: Flags [P.], seq 2699:2754, ack 37277, win 1002, options [nop,nop,TS val 1891714966 ecr 589318185], length 55
11:31:04.404485 IP 67.194.197.7.49951 > 74.125.133.189.443: Flags [.], ack 2754, win 8188, options [nop,nop,TS val 589340054 ecr 1891714966], length 0
11:31:08.876236 IP 74.125.133.189.443 > 67.194.197.7.49951: Flags [P.], seq 2754:2809, ack 37277, win 1002, options [nop,nop,TS val 1891719462 ecr 589340054], length 55
11:31:08.876415 IP 67.194.197.7.49951 > 74.125.133.189.443: Flags [.], ack 2809, win 8188, options [nop,nop,TS val 589344523 ecr 1891719462], length 0
11:31:08.886455 IP 67.194.197.7.49951 > 74.125.133.189.443: Flags [.], seq 37277:38695, ack 2809, win 8192, options [nop,nop,TS val 589344533 ecr 1891719462], length 1418
11:31:08.886457 IP 67.194.197.7.49951 > 74.125.133.189.443: Flags [P.], seq 38695:40014, ack 2809, win 8192, options [nop,nop,TS val 589344533 ecr 1891719462], length 1319
11:31:08.905330 IP 74.125.133.189.443 > 67.194.197.7.49951: Flags [.], ack 38695, win 1002, options [nop,nop,TS val 1891719491 ecr 589344533], length 0
11:31:08.905908 IP 74.125.133.189.443 > 67.194.197.7.49951: Flags [.], ack 40014, win 1002, options [nop,nop,TS val 1891719492 ecr 589344533], length 0
11:31:08.959035 IP 74.125.133.189.443 > 67.194.197.7.49951: Flags [P.], seq 2809:2861, ack 40014, win 1002, options [nop,nop,TS val 1891719545 ecr 589344533], length 52
11:31:08.959157 IP 74.125.133.189.443 > 67.194.197.7.49951: Flags [P.], seq 2861:2916, ack 40014, win 1002, options [nop,nop,TS val 1891719545 ecr 589344533], length 55
11:31:08.959186 IP 67.194.197.7.49951 > 74.125.133.189.443: Flags [.], ack 2861, win 8188, options [nop,nop,TS val 589344605 ecr 1891719545], length 0
11:31:08.959246 IP 67.194.197.7.49951 > 74.125.133.189.443: Flags [.], ack 2916, win 8188, options [nop,nop,TS val 589344605 ecr 1891719545], length 0
11:31:29.996075 IP 74.125.133.189.443 > 67.194.197.7.49951: Flags [P.], seq 2916:2971, ack 40014, win 1002, options [nop,nop,TS val 1891740525 ecr 589344605], length 55
11:31:29.996250 IP 67.194.197.7.49951 > 74.125.133.189.443: Flags [.], ack 2971, win 8188, options [nop,nop,TS val 589365494 ecr 1891740525], length 0
11:31:29.996555 IP 74.125.133.189.443 > 67.194.197.7.49951: Flags [P.], seq 2971:3004, ack 40014, win 1002, options [nop,nop,TS val 1891740525 ecr 589344605], length 33
11:31:29.996685 IP 67.194.197.7.49951 > 74.125.133.189.443: Flags [.], ack 3004, win 8189, options [nop,nop,TS val 589365494 ecr 1891740525], length 0
11:31:30.005525 IP 67.194.197.7.49951 > 74.125.133.189.443: Flags [.], seq 40014:41432, ack 3004, win 8192, options [nop,nop,TS val 589365503 ecr 1891740525], length 1418
11:31:30.005527 IP 67.194.197.7.49951 > 74.125.133.189.443: Flags [.], seq 41432:42850, ack 3004, win 8192, options [nop,nop,TS val 589365503 ecr 1891740525], length 1418
11:31:30.005529 IP 67.194.197.7.49951 > 74.125.133.189.443: Flags [P.], seq 42850:43490, ack 3004, win 8192, options [nop,nop,TS val 589365503 ecr 1891740525], length 640
11:31:30.024712 IP 74.125.133.189.443 > 67.194.197.7.49951: Flags [.], ack 41432, win 1002, options [nop,nop,TS val 1891740611 ecr 589365503], length 0
11:31:30.025435 IP 74.125.133.189.443 > 67.194.197.7.49951: Flags [.], ack 42850, win 1002, options [nop,nop,TS val 1891740611 ecr 589365503], length 0
11:31:30.025932 IP 74.125.133.189.443 > 67.194.197.7.49951: Flags [.], ack 43490, win 992, options [nop,nop,TS val 1891740611 ecr 589365503], length 0
11:31:30.109507 IP 74.125.133.189.443 > 67.194.197.7.49951: Flags [P.], seq 3004:3055, ack 43490, win 1002, options [nop,nop,TS val 1891740695 ecr 589365503], length 51
11:31:30.109625 IP 67.194.197.7.49951 > 74.125.133.189.443: Flags [.], ack 3055, win 8188, options [nop,nop,TS val 589365606 ecr 1891740695], length 0
11:31:30.109920 IP 74.125.133.189.443 > 67.194.197.7.49951: Flags [P.], seq 3055:3110, ack 43490, win 1002, options [nop,nop,TS val 1891740695 ecr 589365503], length 55
11:31:30.109990 IP 67.194.197.7.49951 > 74.125.133.189.443: Flags [.], ack 3110, win 8188, options [nop,nop,TS val 589365606 ecr 1891740695], length 0
11:31:38.459146 IP 74.125.133.189.443 > 67.194.197.7.49951: Flags [P.], seq 3110:3165, ack 43490, win 1002, options [nop,nop,TS val 1891748977 ecr 589365606], length 55
11:31:38.459328 IP 67.194.197.7.49951 > 74.125.133.189.443: Flags [.], ack 3165, win 8188, options [nop,nop,TS val 589373919 ecr 1891748977], length 0
11:31:58.615087 IP 74.125.133.189.443 > 67.194.197.7.49951: Flags [P.], seq 3165:3220, ack 43490, win 1002, options [nop,nop,TS val 1891769140 ecr 589373919], length 55
11:31:58.615242 IP 67.194.197.7.49951 > 74.125.133.189.443: Flags [.], ack 3220, win 8188, options [nop,nop,TS val 589394040 ecr 1891769140], length 0
11:32:04.278406 IP 74.125.133.189.443 > 67.194.197.7.49951: Flags [P.], seq 3220:3275, ack 43490, win 1002, options [nop,nop,TS val 1891774864 ecr 589394040], length 55
11:32:04.278590 IP 67.194.197.7.49951 > 74.125.133.189.443: Flags [.], ack 3275, win 8188, options [nop,nop,TS val 589399619 ecr 1891774864], length 0
11:32:04.286203 IP 67.194.197.7.49951 > 74.125.133.189.443: Flags [.], seq 43490:44908, ack 3275, win 8192, options [nop,nop,TS val 589399626 ecr 1891774864], length 1418
11:32:04.286205 IP 67.194.197.7.49951 > 74.125.133.189.443: Flags [P.], seq 44908:46227, ack 3275, win 8192, options [nop,nop,TS val 589399626 ecr 1891774864], length 1319
11:32:04.306945 IP 74.125.133.189.443 > 67.194.197.7.49951: Flags [.], ack 44908, win 1002, options [nop,nop,TS val 1891774891 ecr 589399626], length 0
11:32:04.307207 IP 74.125.133.189.443 > 67.194.197.7.49951: Flags [.], ack 46227, win 1002, options [nop,nop,TS val 1891774892 ecr 589399626], length 0
11:32:04.368556 IP 74.125.133.189.443 > 67.194.197.7.49951: Flags [P.], seq 3275:3328, ack 46227, win 1002, options [nop,nop,TS val 1891774954 ecr 589399626], length 53
11:32:04.368717 IP 67.194.197.7.49951 > 74.125.133.189.443: Flags [.], ack 3328, win 8188, options [nop,nop,TS val 589399706 ecr 1891774954], length 0
11:32:04.369022 IP 74.125.133.189.443 > 67.194.197.7.49951: Flags [P.], seq 3328:3383, ack 46227, win 1002, options [nop,nop,TS val 1891774954 ecr 589399626], length 55
11:32:04.369106 IP 67.194.197.7.49951 > 74.125.133.189.443: Flags [.], ack 3383, win 8188, options [nop,nop,TS val 589399706 ecr 1891774954], length 0
11:32:27.165333 IP 74.125.133.189.443 > 67.194.197.7.49951: Flags [P.], seq 3383:3438, ack 46227, win 1002, options [nop,nop,TS val 1891797751 ecr 589399706], length 55
11:32:27.165504 IP 67.194.197.7.49951 > 74.125.133.189.443: Flags [.], ack 3438, win 8188, options [nop,nop,TS val 589422369 ecr 1891797751], length 0
11:32:27.166926 IP 74.125.133.189.443 > 67.194.197.7.49951: Flags [P.], seq 3438:3471, ack 46227, win 1002, options [nop,nop,TS val 1891797751 ecr 589399706], length 33
11:32:27.167005 IP 67.194.197.7.49951 > 74.125.133.189.443: Flags [.], ack 3471, win 8189, options [nop,nop,TS val 589422370 ecr 1891797751], length 0
11:32:27.176613 IP 67.194.197.7.49951 > 74.125.133.189.443: Flags [.], seq 46227:47645, ack 3471, win 8192, options [nop,nop,TS val 589422379 ecr 1891797751], length 1418
11:32:27.176614 IP 67.194.197.7.49951 > 74.125.133.189.443: Flags [.], seq 47645:49063, ack 3471, win 8192, options [nop,nop,TS val 589422379 ecr 1891797751], length 1418
11:32:27.176615 IP 67.194.197.7.49951 > 74.125.133.189.443: Flags [P.], seq 49063:49703, ack 3471, win 8192, options [nop,nop,TS val 589422379 ecr 1891797751], length 640
11:32:27.195991 IP 74.125.133.189.443 > 67.194.197.7.49951: Flags [.], ack 47645, win 1002, options [nop,nop,TS val 1891797781 ecr 589422379], length 0
11:32:27.197295 IP 74.125.133.189.443 > 67.194.197.7.49951: Flags [.], ack 49063, win 1002, options [nop,nop,TS val 1891797782 ecr 589422379], length 0
11:32:27.197569 IP 74.125.133.189.443 > 67.194.197.7.49951: Flags [.], ack 49703, win 992, options [nop,nop,TS val 1891797782 ecr 589422379], length 0
11:32:27.251277 IP 74.125.133.189.443 > 67.194.197.7.49951: Flags [P.], seq 3471:3522, ack 49703, win 1002, options [nop,nop,TS val 1891797837 ecr 589422379], length 51
11:32:27.251416 IP 67.194.197.7.49951 > 74.125.133.189.443: Flags [.], ack 3522, win 8188, options [nop,nop,TS val 589422452 ecr 1891797837], length 0
11:32:27.251597 IP 74.125.133.189.443 > 67.194.197.7.49951: Flags [P.], seq 3522:3577, ack 49703, win 1002, options [nop,nop,TS val 1891797837 ecr 589422379], length 55
11:32:27.251654 IP 67.194.197.7.49951 > 74.125.133.189.443: Flags [.], ack 3577, win 8188, options [nop,nop,TS val 589422452 ecr 1891797837], length 0
11:32:33.605079 IP 74.125.133.189.443 > 67.194.197.7.49951: Flags [P.], seq 3577:3632, ack 49703, win 1002, options [nop,nop,TS val 1891803991 ecr 589422452], length 55
11:32:33.605254 IP 67.194.197.7.49951 > 74.125.133.189.443: Flags [.], ack 3632, win 8188, options [nop,nop,TS val 589428782 ecr 1891803991], length 0
11:32:52.201262 IP 74.125.133.189.443 > 67.194.197.7.49951: Flags [P.], seq 3632:3687, ack 49703, win 1002, options [nop,nop,TS val 1891822753 ecr 589428782], length 55
11:32:52.201477 IP 67.194.197.7.49951 > 74.125.133.189.443: Flags [.], ack 3687, win 8188, options [nop,nop,TS val 589447329 ecr 1891822753], length 0
11:33:01.912253 IP 74.125.133.189.443 > 67.194.197.7.49951: Flags [P.], seq 3687:3742, ack 49703, win 1002, options [nop,nop,TS val 1891832360 ecr 589447329], length 55
11:33:01.912432 IP 67.194.197.7.49951 > 74.125.133.189.443: Flags [.], ack 3742, win 8188, options [nop,nop,TS val 589457012 ecr 1891832360], length 0
11:33:01.920244 IP 67.194.197.7.49951 > 74.125.133.189.443: Flags [.], seq 49703:51121, ack 3742, win 8192, options [nop,nop,TS val 589457019 ecr 1891832360], length 1418
11:33:01.920246 IP 67.194.197.7.49951 > 74.125.133.189.443: Flags [P.], seq 51121:52440, ack 3742, win 8192, options [nop,nop,TS val 589457019 ecr 1891832360], length 1319
11:33:01.939284 IP 74.125.133.189.443 > 67.194.197.7.49951: Flags [.], ack 51121, win 1002, options [nop,nop,TS val 1891832525 ecr 589457019], length 0
11:33:01.940695 IP 74.125.133.189.443 > 67.194.197.7.49951: Flags [.], ack 52440, win 1002, options [nop,nop,TS val 1891832526 ecr 589457019], length 0
11:33:01.993827 IP 74.125.133.189.443 > 67.194.197.7.49951: Flags [P.], seq 3742:3793, ack 52440, win 1002, options [nop,nop,TS val 1891832580 ecr 589457019], length 51
11:33:01.993992 IP 67.194.197.7.49951 > 74.125.133.189.443: Flags [.], ack 3793, win 8188, options [nop,nop,TS val 589457092 ecr 1891832580], length 0
11:33:01.994645 IP 74.125.133.189.443 > 67.194.197.7.49951: Flags [P.], seq 3793:3848, ack 52440, win 1002, options [nop,nop,TS val 1891832580 ecr 589457019], length 55
11:33:01.994746 IP 67.194.197.7.49951 > 74.125.133.189.443: Flags [.], ack 3848, win 8188, options [nop,nop,TS val 589457092 ecr 1891832580], length 0
11:33:18.831284 IP 74.125.133.189.443 > 67.194.197.7.49951: Flags [P.], seq 3848:3903, ack 52440, win 1002, options [nop,nop,TS val 1891849345 ecr 589457092], length 55
11:33:18.831462 IP 67.194.197.7.49951 > 74.125.133.189.443: Flags [.], ack 3903, win 8188, options [nop,nop,TS val 589473894 ecr 1891849345], length 0
11:33:18.841854 IP 67.194.197.7.49951 > 74.125.133.189.443: Flags [.], seq 52440:53858, ack 3903, win 8192, options [nop,nop,TS val 589473904 ecr 1891849345], length 1418
11:33:18.841856 IP 67.194.197.7.49951 > 74.125.133.189.443: Flags [.], seq 53858:55276, ack 3903, win 8192, options [nop,nop,TS val 589473904 ecr 1891849345], length 1418
11:33:18.841856 IP 67.194.197.7.49951 > 74.125.133.189.443: Flags [P.], seq 55276:55916, ack 3903, win 8192, options [nop,nop,TS val 589473904 ecr 1891849345], length 640
11:33:18.861467 IP 74.125.133.189.443 > 67.194.197.7.49951: Flags [.], ack 53858, win 1002, options [nop,nop,TS val 1891849447 ecr 589473904], length 0
11:33:18.862203 IP 74.125.133.189.443 > 67.194.197.7.49951: Flags [.], ack 53858, win 1002, options [nop,nop,TS val 1891849448 ecr 589473904,nop,nop,sack 1 {55276:55916}], length 0
11:33:18.862704 IP 74.125.133.189.443 > 67.194.197.7.49951: Flags [.], ack 55916, win 982, options [nop,nop,TS val 1891849448 ecr 589473904], length 0
11:33:18.937431 IP 74.125.133.189.443 > 67.194.197.7.49951: Flags [P.], seq 3903:3956, ack 55916, win 1002, options [nop,nop,TS val 1891849523 ecr 589473904], length 53
11:33:18.937613 IP 67.194.197.7.49951 > 74.125.133.189.443: Flags [.], ack 3956, win 8188, options [nop,nop,TS val 589473998 ecr 1891849523], length 0
11:33:18.937737 IP 74.125.133.189.443 > 67.194.197.7.49951: Flags [P.], seq 3956:4011, ack 55916, win 1002, options [nop,nop,TS val 1891849523 ecr 589473904], length 55
11:33:18.937866 IP 67.194.197.7.49951 > 74.125.133.189.443: Flags [.], ack 4011, win 8188, options [nop,nop,TS val 589473998 ecr 1891849523], length 0
11:33:27.711001 IP 74.125.133.189.443 > 67.194.197.7.49951: Flags [P.], seq 4011:4066, ack 55916, win 1002, options [nop,nop,TS val 1891858251 ecr 589473998], length 55
11:33:27.711196 IP 67.194.197.7.49951 > 74.125.133.189.443: Flags [.], ack 4066, win 8188, options [nop,nop,TS val 589482762 ecr 1891858251], length 0
11:33:47.032298 IP 74.125.133.189.443 > 67.194.197.7.49951: Flags [P.], seq 4066:4121, ack 55916, win 1002, options [nop,nop,TS val 1891877589 ecr 589482762], length 55
11:33:47.032433 IP 67.194.197.7.49951 > 74.125.133.189.443: Flags [.], ack 4121, win 8188, options [nop,nop,TS val 589502048 ecr 1891877589], length 0
11:33:54.368816 IP 74.125.133.189.443 > 67.194.197.7.49951: Flags [P.], seq 4121:4176, ack 55916, win 1002, options [nop,nop,TS val 1891884953 ecr 589502048], length 55
11:33:54.368981 IP 67.194.197.7.49951 > 74.125.133.189.443: Flags [.], ack 4176, win 8188, options [nop,nop,TS val 589509369 ecr 1891884953], length 0
